Cargo,Local,Empresa,Descrição,Link
Engenheiro de Dados,"Rio de Janeiro, RJ",Sys Manager,Se você é da área de tecnologia e está em busca de novos desafios!Conhecimento em Cloud (AWS ou Google ou Azure) e containers; Mascaramento e anonimização de…,https://tinyurl.com/y6tzgo43
ESPECIALISTA ENGENHEIRO DE DADOS,"Rio de Janeiro, RJ",Energisa - Recrutamento Externo,"Construir, otimizar e executar scripts de atualização de dados de forma performática;Garantir as melhores práticas de modelagem e persistência de dados;",https://tinyurl.com/yxqyra3y
Engenheiro de Dados / Cientista de Dados - Sênior - DataSUS,"São Paulo, SP",Keyrus Brazil,Experiência com modelagem de dados.Suporte em integração de dados DataSUS com outras fontes de mercado e internas.Experiência de trabalho com base DataSUS.,https://tinyurl.com/y67wj9j8
engenheiro(a) de dados pleno,"São Paulo, SP",enjoei,Experiência com ingestão de dados em batch.O (a) engenheiro (a) de dados será responsável pela governança dos principais dados da empresa e por fornecê-los da…,https://tinyurl.com/yyydmtzg
Engenheiro(a) de Dados Hadoop,"Brasília, DF",GeekHunter,Conhecimento de modelagem de dados e SQL;Experiência na criação de rotinas de preparação de dados para análises (ETL);O que você irá fazer?,https://tinyurl.com/y56ry4n2
Engenheiro de Dados,"Brasília, DF",Lanlink Informática,Colaborar com a equipe de Ciência de Dados para desenvolver soluções baseadas no ecossistema de dados da Microsoft.Conhecimento em soluções de dados do Azure.,https://tinyurl.com/y533wfaw
Analista de Eng. de Dados,"São Paulo, SP",PayGo Pagamentos,Melhorar a qualidade e eficiência de processos de envio e transformação de dados;Experiência técnica em modelagem de dados e técnicas de segmentação;,https://tinyurl.com/y3yc4ya5
Engenheiro de Dados - Sênior | Python & Spark,"São Paulo, SP",Semantix,Quer impactar bilhões de vidas com dados?Atuar de forma consultiva na Ingestão e tratamento de dados com Python e Spark;,https://tinyurl.com/y6pvkpl4
Engenheiro de Dados Azure Senior,"São Paulo, SP",Keyrus Brazil,"Criar pipelines de ingestão e transformação de dados.Analise e documentação das diversas fontes de dados do cliente (APIs, banco de dados relacionais e NO-SQL)…",https://tinyurl.com/y3xd7bld
Engenheiro(a) de Dados Python Sênior (Remoto),Brasil,GeekHunter,"Arquitetar e construir estruturas para análise e ciência de dados, integrando alto volume de dados captados em nossas várias fontes de dados;",https://tinyurl.com/y44j62gh
Engenheiro de Dados Júnior,"Porto Alegre, RS",WKRH,"Experiência em normalização de dados.Agregar valor aos contratos de uma empresa de prestação de serviços de TI através da consolidação e modelagem de dados,…",https://tinyurl.com/yy7rpver
Engenheiro de Dados GCP,"Campinas, SP",Kumulus Cloud e Data,"Participação em projeto de dados;Noção de Arquitetura de Dados.Metodologias de Gestão de projeto Ágil.Conceitos de Datalake (Raw, Storage, History, Processed…",https://tinyurl.com/yxdw4ovs
Engenheiro de Dados,"Jaraguá do Sul, SC",UpFlux Process Mining,Aplicar e disseminar uma cultura de melhores práticas de engenharia e arquitetura de software e dados;O volume de dados e criticidade dos casos de uso da…,https://tinyurl.com/y33wzzm4
Engenheiro de Dados Sênior,"Campinas, SP",Almon Talentos Humanos,Responsável por encontrar tendências nos conjuntos de dados e desenvolver algoritmos para transformar os dados brutos em informações úteis para tomada de…,https://tinyurl.com/y2whulge
ANALISTA ENGENHEIRO DE DADOS SÊNIOR,"São Paulo, SP",Brasilprev,"Experiência em: Análise e programação de demandas de modelagem e extração de dados.Venha fazer parte do nosso time de tecnologia, onde você terá com o objetivo…",https://tinyurl.com/y4lqkrhh
engenheiro(a) de dados sênior,"São Paulo, SP",enjoei,Experiência com ingestão de dados em batch.O(a) engenheiro(a) de dados será responsável pela governança dos principais dados da empresa e por fornecê-los da…,https://tinyurl.com/y3ujap94
Engenheiro De Dados Foco Em AWS - São Paulo - SP,"São Paulo, SP",Líder e Gestão,"Titulo: Engenheiro de Dados Foco em AWS - São Paulo - SPDescricao: Vaga PJ.Turno: Turno Não InformadoRequisitos: Python, No sql, Sql, Etl, Spark.",https://tinyurl.com/y6dhc3f2
Engenheiro de Dados Júnior,"São Paulo, SP",Lendico Brasil,Análise das fontes de geração de dados.Estamos buscando uma pessoa altamente motivada e qualificada para se juntar à missão de democratizar o uso de dados em…,https://tinyurl.com/y4py2wkg
Engenheiro(a) de Dados (remoto) SQL,Brasil,GeekHunter,O que você irá fazer?At least 3 years of extensive experience.Report to Co-Founder/Managing Partner.Data-driven analytical mindset with 'can-do' attitude.,https://tinyurl.com/y2bcdjfs
Engenheiro de Dados II,"Rio de Janeiro, RJ",PEBMED,"Conhecimentos sólidos de banco de dados, padrões e casos de uso;Construir códigos e scripts de limpeza e tratamento de dados, deduplicação, ajuste de missing…",https://tinyurl.com/y4cu6s3h
Engenheiro de Dados,"São Paulo, SP",Saúde iD - Toda Saúde é única.,Domínio de técnicas de ingestão e tratamento de dados.Habilidade com modelos de governança de dados e regras de segurança.,https://tinyurl.com/y373utm6
Engenheiro de Dados - Sênior,"São Paulo, SP",Semantix,Quer impactar bilhões de vidas com dados?Curso de inglês e espanhol (in company) - Após 03 meses de empresa.Atuar em cliente com os itens abaixo.,https://tinyurl.com/yxd5jwt2
Engenheiro de Dados - Spark & Oracle,"São Paulo, SP",Semantix,"Engenheiro de dados para programação SQL, de preferência com certificação Oracle.Quer impactar bilhões de vidas com dados?",https://tinyurl.com/y2kyjkmg
@ Engenheiro de Dados Python + GCP,"São Paulo, SP",Keyrus Brazil,"Capacidade de análise de soluções apropriadas e criá-las tecnicamente, com a qualidade apropriada (testes em QA, criação de massas de testes, etc).",https://tinyurl.com/y25gp8jp
"Especialista em Engenharia de Dados - Morumbi, SP","São Paulo, SP",UnitedHealth Group,Desenvolvimento de análise de dados;O UnitedHealth Group é um empregador de igualdade de oportunidades de emprego.Conhecimentos em Kubernetes/Docker na Azure;,https://tinyurl.com/y798ah6r
[SP] Engenheiro de Dados,"São Paulo, SP",RADIX Engenharia e Software,"Transformar de dados (manipulação de dados, estruturação de dados, transformações matemáticas, transformações estruturais, leitura e parse de arquivos - excel,…",https://tinyurl.com/yycf3fly
Engenheiro de Qualidade de Dados - Pleno,"Campinas, SP",#vempraGateware,"Gerenciar transformações de serviços de dados e Data Quality usando SQL: analisando dados redundantes e inconsistentes.VR ou VA: R$ 511,00 (mensais);",https://tinyurl.com/y5ypn7v8
Engenheiro(a) de Dados sênior Python (remoto),Brasil,GeekHunter,"Personalização da carteira de benefícios.O que você irá fazer?Administration/maintenance of ElasticSearch servers;Work in Cloud environments (AWS, GCP);",https://tinyurl.com/y352uuak
Engenheiro de Dados Senior - Java & Spark,"São Paulo, SP",Semantix,"Será responsável pelo entendimento e recebimento de atividades relacionadas a engenharia de dados, irá realizar o desenvolvimento e passagem para sustentação.",https://tinyurl.com/y35ypbrs
Engenheiro(a) de Dados Python (Remoto),"Brasília, DF",GeekHunter,"Realizar a higienização de dados;Experiência com manipulação de dados;Neste mês de novembro, o empresa ficou em 1º lugar em cases de sucesso de empresas de…",https://tinyurl.com/y2ltln3y
Especialista em Engenharia de Dados (AWS),Remoto,Funcional Health Tech,"A área de Data Engineering é responsável por realizar a manutenção do Data Warehouse atual, assegurando um processo de transação de dados para ambiente em cloud…",https://tinyurl.com/y6yygcxx
Engenheiro de Dados JR,"São Paulo, SP",HAYS,"Engenheiro de dados JR - CLT.Conhecimento em bancos de dados (MySQL, MS-SQL).Empresa multinacional com abrangência mundial em consultoria de soluções de…",https://tinyurl.com/yddvgj7h
Analista de Engenharia de Dados Pl,"São Paulo, SP",Avanade,"Permita a descoberta de dados de questões centrais, tendências, resultados esperados e reais para humanos e máquinas que consomem os dados.",https://tinyurl.com/y6bbxpql
Engenheiro de dados PL,"São Paulo, SP",HAYS,"Engenheiro de dados PL (CLT).Conhecimentos em banco de dados (MySQL, MS-SQL.Pacote de remuneração e benefícios atrativo e plano de carreira.",https://tinyurl.com/yc8c9xet
Engenheiro de Dados PL/SR,"Curitiba, PR",TAKING,"Aplicação de regras de negócios e disponibilização nas estruturas de dados.REQUISITOS: -Prática no desenvolvimento de pipelines de dados, fazendo uso de Python…",https://tinyurl.com/y6p8jahf
Estágio - Engenheiro de dados,"Curitiba, PR",ROIT,Desenvolvimento de Pipelines de ETL.Sustentação de bancos e etls.Iniciamos nosso dia com uma Daily com todos os Roiters para alinharmos expectativas e trazer…,https://tinyurl.com/y58dmcy7
Engenheiro de Dados Júnior/Pleno,"São Paulo, SP",Leega Consultoria,"Extrair, organizar, tratar e disponibilizar os dados gerando indicadores para tomada de decisões gerenciais e de alto nível.",https://tinyurl.com/y5ohvl5t
Engenheiro de Dados Senior,"São Paulo, SP",Cognizant,"Bachelors in science , engineering or equivalent.Understand the functional/ nonfunctional requirements.Prepare the list of requirements and seek review inputs…",https://tinyurl.com/y4lqpgau
Engenheiro de Dados Sênior,"São Paulo, SP",TAKING,.O time de Engenharia de Dados é responsável por construir todo o alicerce de dados que os.Monitorar e implementar de boas práticas de Qualidade de Dados.,https://tinyurl.com/y6smp44b
Engenheiro de Dados AWS Sênior,"Barueri, SP",Leega Consultoria,"Modelagem de Dados Relacional e Dimensional.Se você busca uma empresa dinâmica e parceira e que investe em seus colaboradores através de capacitação constante,…",https://tinyurl.com/y6fpadkb
Engenharia de Dados| Presencial,"Jaguariúna, SP",Ambev Tech,Liderar frentes técnicas de engenharia de dados;Automatizar processos de ingestão e processamento de dados.Colaborar com cientista de dados para implementar e…,https://tinyurl.com/yxj2p2um
Engenheiro de Dados Senior,"Belo Horizonte, MG",Inklua Servicos Para Inclusao de Pcd Ltda,Atividades: Definir e manipular a arquitetura de dados da área de Business Intelligence (BI); Construir e gerenciar pipelines confiáveis de dados envolvendo…,https://tinyurl.com/y6mom35z
Engenheiro de Dados Pleno/Sênior,"São Paulo, SP",Leega Consultoria,"Extrair, organizar, tratar e disponibilizar os dados gerando indicadores para tomada de decisões gerenciais e de alto nível.",https://tinyurl.com/yxbc3pzv
Engenheiro de dados SR,"São Paulo, SP",Semantix,Quer impactar bilhões de vidas com dados?Curso de inglês e espanhol (in company) - Após 03 meses de empresa.,https://tinyurl.com/yxuzgtjk
Engenheiro de Dados,"São Paulo, SP",Curriculum.com.br,"Conhecimento avançado em Modelagem de Dados; Conhecimento avançado em Integração de Dados; Conhecimento avançado em Banco de Dados (SQL, Postgre, MongoDB) e…",https://tinyurl.com/yc23vaec
Engenheiro de Dados Jr.,"São Paulo, SP",PagSeguro PagBank,Avaliar e mentorear tecnicamente os engenheiros de dados.Conhecimento em arquitetura de dados.Conhecimento em modelagem de dados.,https://tinyurl.com/y3k36msz
Engenheiro de Dados,"Morumbi, SP",Mazzatech,"EXPERIÊNCIA: Conhecimento avançado em Modelagem de Dados ; Conhecimento avançado em Integração de Dados; Conhecimento avançado em Banco de Dados (SQL, Postgre,…",https://tinyurl.com/y65nt28r
Engenheiro/a de Dados Senior Teradata,"São Paulo, SP",Ernst & Young,Experiência em projetos de análise de dados relacionados ao Teradata / PowerCenter;Desenvolver processos de integração de dados (ETL) usando os recursos da…,https://tinyurl.com/y43l2rdu
Engenheiro(a) de Dados Sênior,"São Paulo, SP",Acesso,"Conduzir projetos de soluções analíticas, identificar e viabilizar a aplicação de novas tecnologias, visando a disponibilização de dados para auxiliar na tomada…",https://tinyurl.com/yymdxn72
Engenheiro de Dados Jr.,"São Paulo, SP",Ernst & Young,Auxiliar na criação e manutenção de pipeline de dados.Garantir a ingestão e disponibilização de dados nos ambientes de BI.Fazer a Modelagem de Dados em ErWin;,https://tinyurl.com/y5nqaapy
Engenheiro de Dados Pleno,"São Carlos, SP",Grupo diMelo,"Acompanhar release de pacotes de aplicações.Contribuir na definição das camadas de dados e seu respectivo uso;Tipo de vaga: Tempo Integral, Efetivo/CLT.",https://tinyurl.com/yyt8cadr
Engenheiro(a) de Dados Google Cloud,Brasil,GeekHunter,Construção de solução de pipeline de dados utilizando suíte Google Cloud;Será responsável pela automatização de processos e construção de pipelines.,https://tinyurl.com/y358pmqb
Engenheiro/a de Dados Sênior,"Brasília, DF",Ernst & Young,Atuar em processos de desenvolvimento de componentes de integração de dados;Auxiliar no Desenvolvimento de novos estudos baseado em diferentes tipos de dados.,https://tinyurl.com/y23keqr8
Engenheiro de Dados,"São Paulo, SP",OEmprego,"Sólido conhecimento em ambiente SPARK, HADOOP e soluções de ingestão de grande volume de dados.Experiência em definição de soluções de dados para necessidades…",https://tinyurl.com/y5ge7rbk
Diretor de Engenharia de Dados,"Campinas, SP",Michael Page,"Obrigatório experiência com liderança de times de dados focado em dados de mkt.Experiência na gestão de dados de ponta-a-ponta, com controles de qualidade,…",https://tinyurl.com/y2vtwek4
Engenheiro de Dados/Big Data,"São Paulo, SP",Share RH,Realizar avaliação de conformidade dos processos de integração de dados implementados.Definir soluções que envolvam integração de dados de grande complexidade;,https://tinyurl.com/yy2cqs6p
Engenheiro de Dados,"São Paulo, SP",5A Consultoria,"Desenvolvimento de soluções com grandes volumes de dados, seja offline ou real time;Experiência com modelagem dimensional de dados reporting e dashsboards como…",https://tinyurl.com/y6mzvpq4
[Deloitte] Engenheiro de Dados,"Recife, PE",Porto Digital,"Modelagem e estruturação de dados.Nosso processo de seleção visa atrair essa pluralidade de perfis à nossa cultura corporativa, para que convivam, troquem…",https://tinyurl.com/y3c54rop
Engenheiro/a de Dados Teradata,"São Paulo, SP",Ernst & Young,Experiência em projetos de análise de dados relacionados ao Teradata / PowerCenter;Desenvolver processos de integração de dados (ETL) usando os recursos da…,https://tinyurl.com/y2x69x7c
Gerente Data and Analytics (Engenharia de Dados),"Brasília, DF",Ernst & Young,"Projetar soluções de Engenharia de Dados que usam uma coleção de tecnologias para atingir metas, dada uma ampla variedade de ambientes e tipos de dados.",https://tinyurl.com/y2bp7w8f
Engenheiro de Dados - Pleno,Remoto,A3Data,Conhecimento de modelagem de dados e uso do BigQuery.Integração das plataformas de visualização de dados com Cloud.** Vaga de um cliente da Talentbrand ***.,https://tinyurl.com/y5ntv5ng
Engenheiro de Dados - Sênior,Remoto,A3Data,Conhecimento de modelagem de dados e uso do BigQuery.Integração das plataformas de visualização de dados com Cloud.** Vaga de um cliente da Talentbrand ***.,https://tinyurl.com/yyu2qfk6
Engenheiro de Dados Sênior,"São Paulo, SP",Blend IT,Experiência com criação de pipelines de ingestão de dados usando Google Cloud.Conhecimento em criação de processos de carga de dados batch e streaming (origem…,https://tinyurl.com/y5tbv3to
Engenheiro de Dados Pleno,"São Paulo, SP",Blend IT,Experiência com criação de pipelines de ingestão de dados usando Google Cloud.Conhecimento em criação de processos de carga de dados batch e streaming (origem…,https://tinyurl.com/yxgxq6jy
Engenheiro de Dados Sênior,"Manaus, AM","Liferay, Inc","Construir batchs em larga escala e pipelines de dados em tempo real com frameworks de processamento de dados como o Apache Beam, o Apache Spark e a Plataforma…",https://tinyurl.com/y2kfmcm7
Engenheiro De Dados SR (Remoto) - Porto Alegre - RS,"Porto Alegre, RS",Líder e Gestão,Framework de processamento distribuído Scala;Premiação por tempo de empresa;Domínio pe Processo de ETL / ELT;Conhecimento de consultas SQL (preferencial).,https://tinyurl.com/y3buysvs
Engenheiro de Dados (Azure) (PI),"Campinas, SP",OEmprego,Gerenciamento de banco de dados na nuvem.Atuar na estruturação de plataforma de dados no Azure.Criação de ETL com Data Factory.| Ensino: . | Turno: Integral.,https://tinyurl.com/y65exvko
Engenheiro(a) de Dados Hadoop Júnior (remoto),"São Paulo, SP",GeekHunter,"Atuação com Big Data, programação, banco de dados, fluxo, processos de transformação.Convênio com desconto em instituições de ensino e cursos de Idiomas;",https://tinyurl.com/y5vlfyxr
Pessoa Engenheira de Dados Sênior,"Porto Alegre, RS",Lojas Renner S.A.,Essa pessoa atuará em conjunto com os times de ciência de dados e de machine learning:No desenvolvimento e no uso de tecnologia de dados para projetos da…,https://tinyurl.com/yyzakkgf
Engenheiro de Dados Pl.,"São Paulo, SP",PagSeguro PagBank,Avaliar e mentorear tecnicamente os engenheiros de dados.Conhecimento em arquitetura de dados.Conhecimento em modelagem de dados.,https://tinyurl.com/y4ubmwxy
Engenheiro de Dados (Talend),"São Paulo, SP",HAYS,"Busco um engenheiro de dados para atuar em uma Consultoria de soluções de negócios, estratégia, transformação digital, aplicações tecnológicas e outsoucing.",https://tinyurl.com/y5xa24pm
Engenheiro de Dados Sênior,"São Paulo, SP",HAYS,"Pacote de benefícios atrativo de mercado!Como Engenheiro de Dados, você vai utilizar seus sólidos conhecimentos em Azure Dataflow - PowerBI Conhecimento em…",https://tinyurl.com/y3q5z7w9
Engenheiro(a) de Dados,"Curitiba, PR",hilab,Experiência em desenvolvimento de pipeline de dados;Manutenção e atualização do pipeline de dados;Garantir a disponibilidade de dados para o resto da empresa;,https://tinyurl.com/y6ehzcwy
Engenheiro (a) de Dados - São Paulo,"São Paulo, SP",Newik,Acompanhar release de pacotes de aplicações.Contribuir na definição das camadas de dados e seu respectivo uso;Temos vagas para nível júnior e pleno!,https://tinyurl.com/y635lrw6
Engenheiro/a de Dados,"São Paulo, SP",EY,Garantir a ingestão e disponibilização de dados nos ambientes de BI.Auxiliar no desenvolvimento de novos estudos baseado em diferentes tipos de dados.,https://tinyurl.com/yy6tphf7
Engenheiro(a) de Dados Data science sênior,"São Paulo, SP",GeekHunter,"Trabalhar próximo aos demais engenheiros de backend, cientistas de dados, analistas de dados, product owners e analistas de qualidade;O que você irá fazer?",https://tinyurl.com/yyjrqfue
Engenheiro de Dados BI Sr.,"São Paulo, SP",People Talent, Atualizar e acompanhar indicadores de disponibilidade e processamentos de dados nas ferramentas de. Analisar e corrigir eventuais problemas na execução de…,https://tinyurl.com/y4wo5hzw
Gerente - Engenheiro/a de Dados,"São Paulo, SP",EY,"Desenvolvimento de novos estudos baseado em diferentes tipos de dados.Criação e manutenção de pipeline de dados utilizando os sistemas disponíveis (Hadoop,…",https://tinyurl.com/yyg59ecb
Engenheiro(a) de Dados Data science,"São Paulo, SP",GeekHunter,"Trabalhar próximo aos demais engenheiros de backend, cientistas de dados, analistas de dados, product owners e analistas de qualidade;O que você irá fazer?",https://tinyurl.com/y3ftj4ak
Engenheiro (a) de Dados - São Carlos,"São Paulo, SP",Newik,Acompanhar o lançamento de pacotes de aplicações.Contribuir na definição das camadas de dados e seu respectivo uso;Temos vagas para nível júnior e pleno!,https://tinyurl.com/yx9edrqb
Analista Engenharia de Dados Sênior,"São Paulo, SP",Conquest One,"Desenvolvimento de pipeline de dados na nuvem.Entendimento de demanda de diversas áreas da empresa.Conhecimentos em banco de dados, com SQL avançado e…",https://tinyurl.com/y3559qf5
Engenheiro de Dados de Qualidade (DEQ) e Governança de Dados...,"São Paulo, SP",INEX,"Conhecimento das ferramentas Informatica DEQ e EDC (10.4.1).Conhecimento da ferramenta Informatica Data Engineering Quality (DEQ 10.4.1): Profile, Score Cards,…",https://tinyurl.com/y6o2ar4r
Engenheiro de Dados,"São Paulo, SP",Indra,"Extrair, transformar e carregar (ETL) dados de um banco de dados para outro;Boa vivencia em Engenharia de dados;Conhecimento e experiência avançada com SQL.",https://tinyurl.com/y2cf2qud
Engenheiro de Dados de Integração (Desenvolvedor ETL),"São Paulo, SP",INEX,"Conhecimento em criptografia/mascaramento de dados, LGPD, conceitos de camada de dados bruto, confiável e refinado.",https://tinyurl.com/y5e6kokb
Engenheiro(a) de Dados Pleno,"São Paulo, SP",GeekHunter,Desenvolvimento de bases de dados via SQL.A Studio Z é uma das maiores redes de fast fashion de calçados do Brasil.O que você irá fazer?,https://tinyurl.com/y4vz8msl
Engenheiro de Dados Sr - Python,"São Paulo, SP",Indra,"Bons conhecimentos em soluções de integração de dados (APIs, softwares, técnicas);Excelente conhecimento em bancos de dados relacionais e não-relacionais;",https://tinyurl.com/y2k5o494
Engenheiro de Dados - Sr (Big Data),"São Paulo, SP",Indra,"Vivencia com Splunk Enterprise, ingestões, criação de painéis, otimização de consultas, melhorias de performance, criação de comandos em python.",https://tinyurl.com/yygva7u5
Engenheiro de Dados Sênior,"João Pessoa, PB",Indra,"Extrair, transformar e carregar (ETL) dados de um banco de dados para outro;Opção de inclusão de dependentes no Plano de Assistência Odontológica com desconto…",https://tinyurl.com/y86h65hp
Engenheiro de Dados Sênior,"Curitiba, PR",Logcomex,"Desenvolver, construir, testar e manter as arquiteturas dos bancos de dados e sistemas de processamento de dados em tempo real e de forma distribuída;",https://tinyurl.com/yy5vq67o
Engenheiro(a) de Dados (remoto) JavaScript,Brasil,GeekHunter,"O que você irá fazer?The day-to-day work of a data engineer includes:Building and maintaining data pipelines using Kubernetes, Airflow and AWS Stack.",https://tinyurl.com/yyud5mhc
Engenheiro de Dados / Power Center,"São Paulo, SP",Leega Consultoria,Sólido conhecimento em banco de dados relacional;Modelagem de Dados Relacional e Dimensional.Experiência com esteiras de CI/CD.,https://tinyurl.com/y6s8oa8g
Engenheiro de Dados GCP,"Barueri, SP",Leega Consultoria,Sólido conhecimento em banco de dados relacional;Modelagem de Dados Relacional e Dimensional.Experiência com esteiras de CI/CD.,https://tinyurl.com/y55rp54t
Engenheiro de Dados Sênior,"Rio de Janeiro, RJ",Robert Half,"Desenvolvimento de pipelines de dados, armazenamento e catálogo de dados;Experiência em levantamento de dados e arquitetura de sistemas...",https://tinyurl.com/y58zvasw
Engenheiro de Dados Sênior,"São Paulo, SP",Comunidade Cognitivo.ai,"Experiência com ferramentas de orquestração de fluxo de dados (Airflow, Luigi e etc);Na nossa comunidade, você tem a oportunidade de aprender com os melhores…",https://tinyurl.com/y5s4dd23
Engenheiro(a) de Dados Python pleno (remoto),Brasil,GeekHunter,"Conhecimentos de teoria de computação (arquitetura de software, POO e APIs), estruturas de dados e BD (SQL e NoSQL) e algorítmos (ML e DL).",https://tinyurl.com/y3avtbfy
Engenheiro de Dados Sênior - Techfin,"São Paulo, SP",TOTVS,"Construir de forma inovadora toda a arquitetura de dados, com vontade de experimentar e enfrentar com ousadia problemas de imensa complexidade e escopo, através…",https://tinyurl.com/yy3losj4
Engenharia de Dados - Analista Pl,"São Paulo, SP",GPA,Desenvolvimento de integrações de dados no ecossistema Hadoop;Organização e garantia da comunicação entre os dados do lake as demais aplicações da diretoria …,https://tinyurl.com/yyzor9ot
Engenheiro de Dados - Splunk,"São Paulo, SP",Indra,"Experiência em criação de painéis, otimização de consultas e melhorias de performance.Opção de inclusão de dependentes no Gympass (até 03 dependentes - pago…",https://tinyurl.com/y5p4cehn
Engenheiro(a) de Dados,"Rio de Janeiro, RJ",B2W Digital,Arquitetar e estruturar plataforma de dados em nuvem capaz de receber milhares de acessos simultâneos;Capacidade de contribuir com otimizações de arquitetura…,https://tinyurl.com/yynchxye
Engenheiro de Dados Pleno e Senior,Remoto,Arquivei,Definição e implementação de arquiteturas escaláveis de processamento de dados.Já passou por migrações de banco de dados.Lidar com um grande volume de dados;,https://tinyurl.com/y4hznmlr
Engenheiro de Dados - Sênior | Python & Streaming,"São Paulo, SP",Semantix,"Desenvolver processos de conjunto de dados.Formato de dados Parquet e Avro, vivência em projetos de Streaming.Quer impactar bilhões de vidas com dados?",https://tinyurl.com/y5bdwymg
Engenheiro de Dados Sr - Splunk,"São Paulo, SP",Semantix,Quer impactar bilhões de vidas com dados?Curso de inglês e espanhol (in company) - Após 03 meses de empresa.Criar comandos em python e Desenvolver scripts que…,https://tinyurl.com/yy4mblx9
Engenheiro(a) de Dados Big Query,"São Paulo, SP",GeekHunter,Desenho de Arquitetura de Soluções num contexto de metodologias ágeis;Liderança de coordenação de equipe;Coordenar as reuniões de trabalho para a captação de…,https://tinyurl.com/y6gv4e4p
Engenheiro(a) de Dados Python pleno,"Hortolândia, SP",GeekHunter,Auxiliar na Criação / Gerenciamento de bancos de dados e serviços de integração de dados.Habilidades de banco de dados relacional e não relacional.,https://tinyurl.com/y223qybn
