Cargo,Local,Empresa,Descrição,Link
Engenheiro de dados - Especialista | Cloud AWS,"São Paulo, SP",Semantix,"Quer impactar bilhões de vidas com dados?Experiências com desenvolvimento de Data Lake especialmente utilizando componentes AWS (S3, Athena) e pipeline de dado…",https://tinyurl.com/y5snsadp
PESSOA ENGENHEIRA DE DADOS,Brasil,Fox Human Capital,"+4 anos de experiência com SQL, bancos de dados relacionais e administração de Banco de Dados.Deverá interagir com analistas de dados e profissionais de…",https://tinyurl.com/y3lrsmkb
Engenheiro(a) de Dados pleno Python,"São Paulo, SP",GeekHunter,"Conhecimento em modelagem de dados; Vivência em ambientes com processos Ágeis; Desejável PySpark, engenharia de sofware e design patterns.O que você irá fazer?",https://tinyurl.com/y4rhkvu3
Engenheiro de Dados Sênior,"Curitiba, PR",Ewave do Brasil,"Construir fluxos de ETL, desde o mapeamento das fontes de dados e sistemas legados, até o tratamento e aplicação de regras de negócios e disponibilização nas…",https://tinyurl.com/yxljro63
Engenheiro de Dados,"Rondonópolis, MT",Só Talentos,"Conhecimento de bancos de dados SQL.Analise de dados e processos internos/ externos com finalidade de responder questões comerciais, além de identificar…",https://tinyurl.com/y3nbclty
Engenheiro de Dados / Desenvolvedor Python ( remoto),"São Paulo, SP",HOLDEN Recruiting Talents,Estamos atendendo grande player da área de tecnologia e buscamos.Analista de Dados (BI)/ Desenvolvedor Python Sênior.,https://tinyurl.com/y27c2vpl
[SP] Engenheiro de Dados Sr.,"São Paulo, SP",RADIX Engenharia e Software,"Transformar de dados (manipulação de dados, estruturação de dados, transformações matemáticas, transformações estruturais, leitura e parse de arquivos - excel,…",https://tinyurl.com/y5hq3kgd
Engenheiro(a) de Dados,"Belo Horizonte, MG",GeekHunter,Processo de preparação de dados.Utilização dos conceitos de classificação e previsão de dados para construção de modelos de machine learning;,https://tinyurl.com/yxuuhoal
Estágio Nível Superior para atuar na área de engenharia de d...,"Florianópolis, SC",Dígitro,"Modelagem de dados, elaboração de scripts de banco de dados, ETL, desenvolvimento javascript, node, python.Cadastre seu currículo na nossa base de dados.",https://tinyurl.com/y3tmyng6
Pessoa Engenheira de Dados,"São Paulo, SP",Centauro - Tecnologia,Atuar no processo de ingestão de dados de diversas origens para o datalake;Ferramentas de ingestão de dados (preferencialmente NIFI) e experiência com captura…,https://tinyurl.com/y6xmm6qz
Engenheiro de Dados - Bari Service,"Curitiba, PR",Banco Bari e Grupo,"Construir fluxos de ETL, desde o mapeamento das fontes de dados e sistemas legados, até o tratamento e aplicação de regras de negócios e disponibilização nas…",https://tinyurl.com/y2nejsjr
Engenheiro de Dados III,"São Paulo, SP",Padrão,"Construir junto com todo o time, usando princípios de engenharia de software para resolver desafios de produção e ajudando as equipes a serem orientadas por…",https://tinyurl.com/yy5l6ymc
Engenheiro(a) de Dados | Advertising,"Poá, SP",Grupo Globo,"Conhcimento de banco de dados não relacionais;Domínio de engenharia de software, princípios, boas práticas e padrões de arquitetura;Como será seu dia a dia:",https://tinyurl.com/y2q7zd2w
Engenheiro(a) de Dados | Advertising,"Poá, SP",Globo,"Conhcimento de banco de dados não relacionais;Domínio de engenharia de software, princípios, boas práticas e padrões de arquitetura;Como será seu dia a dia:",https://tinyurl.com/y5sd85sd
Engenheiro de Dados,"Joinville, SC",Docol,"Conhecimento de Bibliotecas de manipulação de arquivos e visualização de dados (Pandas, Numpy e Matplotlib).Manutenção da governança dos dados.",https://tinyurl.com/y5e8d3cd
Analista de Engenharia de Dados Sr,"Barueri, SP",C&A,Desenvolver fluxos de tratamento de dados utilizando Python;Experiência em tratamento de dados utilizando Python;A C&A é muito eu.,https://tinyurl.com/y2h99neq
Engenheiro(a) de Dados pleno Python (remoto),"São Paulo, SP",GeekHunter,Criação prévia ou manutenção de pipelines de dados complexos;Análise de desempenho de queries.Desenvolver e manter a infraestrutura de nossos dados;,https://tinyurl.com/yyabqdgn
