Cargo,Local,Empresa,Descrição,Link
Analista de Dados Pleno,"Brasília, DF",Klickpages,"Conhecimento em extração e analise de dados.Será responsável pela criação e gestão de dados em massa, Dashboards, gestão e criação de KPIs com métricas de SaaS…",https://tinyurl.com/y57xnry5
ANALISTA DE DADOS,"Fortaleza, CE",O Povo,"Requisitos: Superior Completo na área de Tecnologia da Informação; Conhecimento em Python, Linguagem R, SQL, Ferramenta de visualização de dados e Gráficos.",https://tinyurl.com/y453ftok
Analista de Ciência de Dados – Coach Analytics,"São Paulo, SP",Itaú Unibanco,"Habilidade em computação – Banco de Dados: Modelo de banco de dados relacional; sintaxe de SQL; álgebra relacional: Join, group by, order by; chaves primárias,…",https://tinyurl.com/y36zs3hp
Analista de Dados | Foco em Auditoria de Sistemas,"Porto Alegre, RS",Lojas Renner,"Aprendizado, exploração e auditoria de banco de dados;Conhecimento e experiência em desenvolvimento de queries e SQL em banco de dados Oracle;",https://tinyurl.com/y2fws57b
Analista de Dados,"Curitiba, PR",Grupo Barigüi,Experiência em criação e otimização de pipelines de dados utilizando ferramentas de ETL;Conhecimento avançado em SQL e experiência em sustentação e…,https://tinyurl.com/yyuewsfc
analista de negócios / base de dados,"São Paulo, SP",Randstad,"Experiência com extração de dados , Insights para melhorar produtividade e eficiência e experiência com linguagem de base de dados.",https://tinyurl.com/y6n72v5q
Analista de Dados PL/SQL,"São Paulo, SP",GeekHunter,Experiência em modelagem de dados e tratamento de outliers.Atuar junto a equipe de tecnologia no desenvolvimento de tarefas relacionadas ao banco de dados do…,https://tinyurl.com/yy9zat9o
Analista de Dados Sênior,Remoto,Sallve,Sabe muito de de estatística;Tem experiência com banco de dados relacionais e não relacionais;Já trabalhou com banco de dados relacionais e não relacionais;,https://tinyurl.com/y5mgewlm
Analista de Dados - RH,"Igrejinha, RS",Usaflex,"Experiência em manipulação de dados;Estruturação de dashboard, gerenciamento de relatórios;Desempenhar atividades com alto volume de tarefas analíticas e de…",https://tinyurl.com/y2qjwnjb
ANALISTA DE BANCO DE DADOS,"Rio de Janeiro, RJ",Connectcom,"Executar as atividades de banco de dados, dentro das normas e politicas estabelecidas pela empresa.Preparação de um ambiente de produção.",https://tinyurl.com/y2afcl53
Analista de Dados Júnior,"São Paulo, SP",Cappta,"Conhecimento em linguagens de programação e consulta de dados (SQL, DAX, Python);Familiaridade com ferramentas de visualização de dados (Power BI, Google Data…",https://tinyurl.com/yyq4roqo
Analista de Banco de Dados,"São Paulo, SP",2HRH | Hprojekt,"Análise de dados utilizando Bancos de dados SQL Server e Oracle.Atenta às particularidades de cada negócio, a empresa cria novas práticas de gestão e redefine…",https://tinyurl.com/y4sg6cu4
Analista de Banco de Dados Plena(o),"São Paulo, SP",Easynvest,Realizar o monitoramento de saúde de recursos de bancos de dados.Validar atividades de atualização de sistemas que envolvam aplicação de alterações em bancos…,https://tinyurl.com/y46ltob5
Analista de Dados,"São Paulo, SP",Petz,"Criação e manutenção de banco de dados, tabelas e serviços de dados.Análise de dados para melhorias de negócios.2 a 3 anos de experiência.",https://tinyurl.com/y4hph4yx
Analista de Governança de Dados Pleno,"Uberlândia, MG",Kyros Tecnologia,Experiência em atividades relacionadas à governança de dados e administração de dados.Experiência em modelagem de dados relacional.,https://tinyurl.com/yyzqunr7
Analista de Dados Pleno - PJ (BI),Ceará,MRH,"Prover análises de indicadores utilizando conceitos de estatística através do Planner, dentre outros.Criar métricas, KPIs, extrair , tratar e comparar dados…",https://tinyurl.com/y25hms9h
Analista de TI - PLENO (Banco de Dados),"Rio de Janeiro, RJ",Search Recursos Humanos,"A Search RH está assessorando um cliente bancário para a posição de Analista de TI - Pleno.Participar das definições das melhorias de processo, visando criar,…",https://tinyurl.com/y6ggnjd7
Analista de Dados Jr (DBM / CRM),"Rio de Janeiro, RJ",FGV - Fundação Getulio Vargas,"Exploração de banco de dados de marketing.Armazenamento e estruturação de banco de dados de CRM em SQL;Estatística, Matemática, TI (banco de dados) e áreas…",https://tinyurl.com/y4tskdsa
Analista de Banco de Dados,"Barueri, SP",Moot It Consulting,"Migração de base de dados e ambientes.Conhecimentos sólidos sobre a arquitetura de banco de dados;Aplicação de opatch e upgrade em bancos de dados Oracle, SQL…",https://tinyurl.com/y4u6pq72
Analista de Dados - Inteligência de Mercado,"São Paulo, SP",PlanoeVendas,"Experiência em análise de dados e banco de dados;Buscamos profissional para apoiar nas atividades de análise de dados da nossa área de Vendas, permitindo um…",https://tinyurl.com/y5qstw48
Analista de Dados - Inteligência Competitiva,"Rio de Janeiro, RJ",B2W Digital,Construir dashboards que direcionem as decisões de negócio a partir de dados de mercado e competitividade;Meetups e eventos para troca de conhecimento;,https://tinyurl.com/y5gjczak
Analista de Dados Pleno,"São Paulo, SP",tembici.,Experiência com análise exploratória de dados (e ferramentas de estatística descritiva).Experiência com visualização de dados e data storytelling;,https://tinyurl.com/y2edmpz6
Analista de Gerenciamento de Dados (DM Analyst),"São Paulo, SP",Soulan,"Principais atribuições: Interface com a equipe de desenvolvimento de sistemas, regulatório, sagety, CEC e monitoria, desenvolvimento de Draft de sistemas, eCRF,…",https://tinyurl.com/yyy93vnx
Analista de Dados - Logística,"São Paulo, SP",Olist,"Será responsável pelo desenvolvimento, manutenção e melhoria de dashboards, análise de dados, elaboração e automações de scripts de baixa a média complexidade…",https://tinyurl.com/y2a478qb
Analista de Dados,"Belo Horizonte, MG",MaxMilhas,"Explorar e examinar os dados para encontrar padrões intrínsecos através de análise quantitativa e/ou qualitativa, utilizando-se de técnicas de mineração de…",https://tinyurl.com/yxg8v7hl
Analista de Qualidade de Dados Pleno (Data Q&A),"São Paulo, SP",Share RH,"Ser agente da disseminação de uma cultura de qualidade de dados na squad.Trabalhar em conjunto com a equipe para aprimorar os testes de qualidade de dados,…",https://tinyurl.com/y6ztocpz
Analista de Arquitetura de Soluções e Engenharia de Dados,Brasil,Accenture,Modelagem e implementação de banco de dados informacionais;Capacidade analítica e crítica de dados;Experiência com modelagem e implementação do banco de dados…,https://tinyurl.com/y2osh8lx
Analista de Dados,"Belo Horizonte, MG",Group Software Ltda,Desenvolvimento de rotinas de ETLs e visões de dados.Plano de Saúde e Odontológico.Lidar com o processamento da dados.O que um Grouper tem de benefícios?,https://tinyurl.com/y6kkaq2g
ANALISTA DE DADOS/ BI,"São Paulo, SP",GRUPO HABIBS,MISSÃO: Desenvolver ferramentas e soluções que melhorem a maturidade da análise corporativa para dar suporte à crescente demanda por tomada de decisão centrada…,https://tinyurl.com/y284q2n3
Analista de Dados,"São Paulo, SP",Konduto,Os analistas de dados são os responsáveis pelos estudos analíticos com foco em identificação de padrões comportamentais e.Plano de saúde - sem coparticipação.,https://tinyurl.com/yxfrqcf5
Analista de Dados,"Recife, PE",TI.SAÚDE Tecnologias em Saúde LTDA,"É necessário 2 anos de experiência como analista de dados, com bons conhecimentos de SQL.É importante que o candidato tenha um bom conhecimento sobre o…",https://tinyurl.com/yxhzcpp3
Analista de Banco de Dados (condominial),"Belo Horizonte, MG",Group Software Ltda,"Atuação com ETL, extração de banco de dados, transformação e manutenção de dados, carga de dados.Tenha experiência na implantação e migração de dados;",https://tinyurl.com/y3kjc8mg
Analista de Banco de Dados (imobiliário),"Belo Horizonte, MG",Group Software Ltda,"Atuação com ETL, extração de banco de dados, transformação e manutenção de dados, carga de dados;Evoluir Ferramenta de Migração de Dados visando ganhar…",https://tinyurl.com/yym9alcp
Analista de Dados JR (Facebook),"Curitiba, PR",MadeiraMadeira,Gerenciamento de Catálogos de Produtos.Mindset de solução de problemas.Alto nível de motivação e vontade de aprender.Não paramos nunca de crescer!,https://tinyurl.com/yyclxgms
Analista de Dados SR (Data Visualization),"Curitiba, PR",MadeiraMadeira,"Sua missão será auxiliar na reconstrução da área de Data da MadeiraMadeira, atuando em compartilhar conhecimento entre o time, analisar dados, disponibilizar…",https://tinyurl.com/y397fnml
Analista BI / Adm.de Dados PL SR,"Brasília, DF",G&P Projetos e Sistemas,"Experiência em atividades de desenvolvimento de soluções de Business Intelligence, Data Warehouse e Data Discovery; Experiência em Design, Visualização de Dados…",https://tinyurl.com/y5j3gaxf
Analista Sr (Engenharia de Dados),"São Paulo, SP",GPA,Desenvolvimento de integrações de dados no ecossistema Hadoop;Desenvolvimento de DataMarts para as áreas de negócio;App Pão de Açúcar Mais.,https://tinyurl.com/y3sh3x2f
Analista de Dados Pleno - Prime,"Rio de Janeiro, RJ",B2W Digital,"Ser referência em nossas ferramentas/técnicas de análise de dados relevantes;Nesse time, você terá a oportunidade de apoiar nas tomadas de decisões sobre…",https://tinyurl.com/y6ed6ewf
Analista de Dados CRM,"São Paulo, SP",Repassa,"Vivência com bibliotecas para análises estatísticas de dados.Como nosso(a) Analista de Dados, você terá a missão de acompanhar as ações de Marketing, mensurar…",https://tinyurl.com/y2jgmkmv
Analista de Dados - Mídias Sociais,"Brasília, DF",BriviaDez,O analista de dados é responsável por realizar a verificação de cenários e o diagnósticos de marcas nos canais digitais a partir de dados e do monitoramento.,https://tinyurl.com/yyggb5c7
Analista de Dados,"São Paulo, SP",Dasa,Analisar dados de diversas fontes para a criação de segmentações populacionais e validação de premissas clínicas.Experiência com visualização de dados.,https://tinyurl.com/y2z3nbvc
Analista de Dados,"Curitiba, PR",Indra Company,Criação e manutenção de diagramas de fluxos de dados;Sólida experiência em modelagem de dados: modelagem de banco de dados relacionais e multidimensionais;,https://tinyurl.com/y4nqq5yf
Analista de Suporte a Sistemas e Banco de dados SQL Pleno,"Belo Horizonte, MG",Indra,"Manutenção da base de conhecimento de soluções .Noções de linguagem de programação VB6.0, VB.Obs .: Esta vaga não é de suporte técnico , configuração de…",https://tinyurl.com/y328jcvp
Analista de Inteligência de Dados Logísticos,"Rio de Janeiro, RJ",B2W Digital,"Experiência com análise de dados.Elaborar apresentações e narrativas de negócios para time e outras áreas, baseado na análise de dados.",https://tinyurl.com/yxuvfsk8
Analista de Dados,Remoto,CWI Software,Ser Analista de Dados é um papel importante para qualquer equipe corporativa de análise de dados.Vasta experiência em soluções de dados; - Dominio em Python ou…,https://tinyurl.com/y56zmua9
Analista de Dados,"Cascavel, PR",FUNCTIONAL CONSULTING,"Criar rotinas de extração de dados, elaboração de relatórios e disponibilização para as áreas de negócio;Construir dashboard e painel de indicadores;",https://tinyurl.com/y5czorc2
Analista de Modelagem de Dados - SSA,"Salvador, BA",Solutis,Implementação de tabelas em banco de dados através de linguagem SQL.Construção e administração de modelos de dados corporativos.O que não abrimos mão:,https://tinyurl.com/y4czeazo
Analista de Marketing e Dados JR (PPC Google),"Curitiba, PR",MadeiraMadeira,Gerenciamento de campanhas e controle de budget com base na análise de dados.Experiência com gerenciamento de campanhas e controle de budget com base na…,https://tinyurl.com/y4fwk45k
Analista Engenharia de TI – Engenheiro de Dados,"São Paulo, SP",Mappit,"Experiência na construção de plataformas de Data Lake em nuvem;Experiência em projeto de dados envolvendo o ecossistema Hadoop, Teradata e/ou SAS;",https://tinyurl.com/y23kq8gp
Analista Engenharia de TI - Arquitetura de Dados Sênior,"São Paulo, SP",Mappit,"Conhecimento em ferramentas de modelagem de dados (Ex.: Power Designer, Erwin, etc);Entendendo e aconselhando outras pessoas no uso de tecnologias de banco de…",https://tinyurl.com/y6tctb76
Analista de Dados Sênior,"Curitiba, PR",Kenzie,"Conhecimento prático de tecnologias de armazém de dados, ferramentas de relatório;Mais de 3 anos de experiência relevante, desenvolvendo e implementando…",https://tinyurl.com/y5lzrmv8
Analista de Dados JR 01 VAGA,"Guarulhos, SP",None,Arquitetura de bases de dados.Requisitos técnicos: Conhecimento de lógica de programação (VBA/SQL) Conhecimento de.Analista de Dados JR - Guarulhos.,https://tinyurl.com/y69q3qm8
Analista Financeiro - Banco de Dados,"Fortaleza, CE",RH Teplacon,"De 8 às 18h de segunda a sexta-feira.Planejar e administrar as rotinas financeiras da empresa, contas a pagar e receber, fluxo de caixa, relatórios.",https://tinyurl.com/y39bxe6p
Estágio Analista de Dados - PORTO ALEGRE - 1 VAGA,"Porto Alegre, RS",None,"> Conhecer ferramentas de análises de dados como Tableau ou Power BI;Benefícios: Ajuda de custo de 105,00 para vale transporte.",https://tinyurl.com/y26alvty
Analista de Banco de Dados Jr.,"São Paulo, SP",HEXAGON,Prestará suporte aos nossos clientes no que tange manipulação do banco de dados.O profissional irá atuar na administração dos bancos de dados atrelados às…,https://tinyurl.com/y3vklm3w
Analista Administrativo e de Dados - PORTO ALEGRE - 1 VAGA,"Porto Alegre, RS",None,"Capacidade de análise de dados brutos;Conforto com manipulação de dados;Conhecimento em ferramentas de análise de dados (Google Analytics, Power BI);",https://tinyurl.com/yxkxo5mt
Analista de Dados - Porto Alegre - 1 VAGA,"Porto Alegre, RS",None,"O Analista de dados irá operar o banco de dados, planilhas em Excel e sistemas de inteligência de negócios, big data e atendimento aos clientes em treinamentos…",https://tinyurl.com/yyjjtrdo
ANALISTA COMERCIAL - BANCO DE DADOS,"Lorena, SP",Cosmos RH,Função: Analista Comercial Horário de Trabalho: Horário Administrativo Salário: analisar pretensões Superior Completo Desejável curso de Atendimento do Cliente…,https://tinyurl.com/y2c67xfq
Analista de banco de dados e BI (JR/PL) - MG,"São Paulo, SP",AX4B,Administração de Banco de dados (infraestrutura).Apoiar na execução de projetos em banco de dados e Business Intelligente (BI).,https://tinyurl.com/y5jgmx5y
Analista Engenharia de TI – Engenheiro de Dados,"São Paulo, SP",Mappit,"Experiência na construção de plataformas de Data Lake em nuvem;Experiência em projeto de dados envolvendo o ecossistema Hadoop, Teradata e/ou SAS;",https://tinyurl.com/y3rhqnx4
Analista Engenharia de TI - Arquitetura de Dados Sênior,"São Paulo, SP",Mappit,"Conhecimento em ferramentas de modelagem de dados (Ex.: Power Designer, Erwin, etc);Entendendo e aconselhando outras pessoas no uso de tecnologias de banco de…",https://tinyurl.com/yyxvyuod
Analista Engenharia de TI – Engenheiro de Dados,"São Paulo, SP",Mappit,"Experiência na construção de plataformas de Data Lake em nuvem;Experiência em projeto de dados envolvendo o ecossistema Hadoop, Teradata e/ou SAS;",https://tinyurl.com/y6huf2n7
Analista Engenharia de TI - Arquitetura de Dados Sênior,"São Paulo, SP",Mappit,"Conhecimento em ferramentas de modelagem de dados (Ex.: Power Designer, Erwin, etc);Entendendo e aconselhando outras pessoas no uso de tecnologias de banco de…",https://tinyurl.com/yxkee4c4
