Cargo,Local,Empresa,Descrição,Link
Analista de Dados,"Sorocaba, SP",Goomer,1 ano de experiência profissional com análise de dados.Seu papel como Analista de Dados será trazer mais inteligência para a Goomer nos apoiando nas tomadas de…,https://tinyurl.com/y8k67ptl
Analista de Dados,"Vila Velha, ES",Autoglass,Buscamos um profissional para apoiar as áreas de análises de dados e indicadores.Realizar pesquisas de oportunidades de negócio;Café da manhã e da tarde.,https://tinyurl.com/yajbj3bb
Analista De Dados - BV,"Igrejinha, RS",Buscar Vagas,"Experiência em manipulação de dados.Acompanhar os indicadores de desempenho que quantificam a performance dos processos da área; Estruturação de dashboard,…",https://tinyurl.com/y9n6j87c
Analista de Dados - Sênior,"São Paulo, SP",MAGNA SISTEMAS,Otimização de Bancos de Dados complexos com grande volumes de dados e estruturas relacionadas;Migração de dados para diferentes SGBDs;,https://tinyurl.com/ydco8ezr
Analista de Dados e Programação de Demanda - Mercado Envios,Brasil,Mercado Libre,"Ter experiência com análises quantitativas e qualitativas e com a manipulação de dados.Ser protagonista de seu desenvolvimento em um ambiente de oportunidades,…",https://tinyurl.com/ydz332gt
Analista De Dados - RH - DV,"Igrejinha, RS",Divulga Vagas,"Experiência em manipulação de dados.Estruturação de dashboard, gerenciamento de relatórios;Desempenhar atividades com alto volume de tarefas analíticas e de…",https://tinyurl.com/yd8epuqw
Analista de Infraestrutura Banco de Dados Pleno,"Brasília, DF",Central IT,Graduação de nível superior na área de Tecnologia da Informação;Ampla experiência em Administração e sustentação de banco de dados suportados pelas plataformas…,https://tinyurl.com/y7jhmwwj
Analista De Dados - DV,"São Paulo, SP",Divulga Vagas,"No projeto, extrair dados oriundos de múltiplas fontes, tratar estes dados comparando, ajustando,.Classificando, e organizando a visualização do dado.",https://tinyurl.com/ybxngjsj
analista de dados,"São Paulo, SP",Randstad,Contato prévio em cargos de desenvolvimento de análises de dados.Gerar novos insights a partir de análises de dados e transmitir a informação de.,https://tinyurl.com/yadwofd9
Analista de Dados Júnior,"Blumenau, SC",Curriculum.com.br,"Responsável por definir, propor e manter o modelo de dados dos bancos de dados; Definir níveis de integridade e segurança dos dados; Elaborar e prover padrões…",https://tinyurl.com/y8lmop5b
ANALISTA DE DADOS JR (área de MKT),"São Paulo, SP",Supermercado Now,"Definir e criar indicadores, relatórios e dashboards, através de análise de dados para suporte a tomada de decisão da cia.",https://tinyurl.com/ydxno8fy
Analista de Dados Pleno,"Pinheiros, SP",OmniJus Tecnologia SA,"Trabalhar junto ao time de negócios para encontrar novos meios de consolidação de dados buscando a.Fazer parte do processo de desenvolvimento, aplicando as…",https://tinyurl.com/ybf935ds
Analista de Dados,"São Paulo, SP",Saúde iD - Toda Saúde é única.,"Experiência profissional comprovada como analista de dados ou analista de dados de negócios;Expertise técnica em modelos de dados, desenvolvimento de design de…",https://tinyurl.com/y7csafue
Analista de Dados,"Belo Horizonte, MG",MIP EDIFICAÇOES LTDA,Realizar atividades primárias de pesquisa de mercado.Analisar os dados do mercado e dos concorrentes para descobrir oportunidades de mercado e abordar questões…,https://tinyurl.com/y8trhujz
Analista de Infra e Segurança de Dados PL,"Curitiba, PR",2iM,Segurança de redes e banco de dados;Identificar e definir os objetivos de proteção de dados.Garantir a segurança de dados;Formação na áreas da TI.,https://tinyurl.com/y8hj8bz3
Analista Projetos Pl - (Banco de Dados),"Rio de Janeiro, RJ",Stefanini,Conhecimento em análise de dados;Experiência comprovada em banco de dados;Buscamos profissionais com experiência em Banco de Dados.,https://tinyurl.com/yb8doz73
Analista de dados (Remoto),"Barra da Tijuca, RJ",Blu,"Conhecimentos de Bancos de Dados.Com a missão de utilizar os dados para tomada de decisão dentro BLU, nós estamos buscando uma pessoa Analista de Dados.",https://tinyurl.com/y7cxavuq
Estágio - Analista de Dados,"São Paulo, SP",None,"Suportar os processos de Inteligência de Negócios e Métricas do Videocamp no processo de coleta, organização, análise, compartilhamento e monitoramento de…",https://tinyurl.com/ycxu3cvs
Analista de Dados Pleno (Frete),"São Paulo, SP",B2W Digital,"Como analista de dados na plataforma da LET’S o profissional irá atuar junto a equipe (desenvolvedores, cientista de dados, analistas de negócio) com o papel de…",https://tinyurl.com/yarfj4y8
Analista de Governança de Dados,"Belo Horizonte, MG",IVORY Talent,"Arquitetura de dados, governança de dados.Ferramentas de modelagem de dados.Ferramenta de modelagem de dados Oracle SQL Developer Data Modeler.",https://tinyurl.com/y83x8dwk
Analista de Banco de Dados,"Ouro Preto, MG",Unimed Inconfidentes,Criação de scripts para automação de rotinas e extração de banco de dados;Geração de Relatórios e análise de dados;A vaga requer atividades de:,https://tinyurl.com/y8fsw4dg
Analista de Dados,"Belo Horizonte, MG",Stoque Soluções Tecnológicas,Diretrizes de distanciamento social aplicadas.Protetor facial nos locais de trabalho.Equipamento de proteção individual fornecido ou exigido.,https://tinyurl.com/y8f9yh5t
Analista de Banco de Dados,"São Paulo, SP",Hprojekt,"Análise de dados utilizando Bancos de dados SQL Server e Oracle.Atenta às particularidades de cada negócio, a empresa cria novas práticas de gestão e redefine…",https://tinyurl.com/y7nfp7ep
SENAI/PE - CÓD. 0093 ANALISTA DE DADOS,"Recife, PE",Sistema FIEPE,"Conhecimentos: Inglês, pesquisa, consolidação e estratificação de dados, cálculos e análises estatísticas e de viabilidade de produtos, base de dados e…",https://tinyurl.com/y8qmx4ny
ANALISTA DE BANCO DE DADOS - BV,"Brasília, DF",Buscar Vagas,Sustentação de banco de dados SQL Server;Análise e higienização de base de dados.Requisitos: Formação de nível superior na área de TI.,https://tinyurl.com/yc8n3eox
Analista e/ou Engenheiro de Dados - PJBank - Campinas,"Campinas, SP",Superlógica,Experiência com o tratamento de manipulação de múltiplas fontes de dados e grande volume de dados;Escalar e manter a infraestrutura de dados;,https://tinyurl.com/y9vcvxan
Analista de Ciência de Dados Sênior - Ciclo de Vida,"Barueri, SP",Cielo,"Experiencia em manipulação de banco de dados com linguagem SQL;Experência com ferramenta de visualização de dados como Tableau, Microstrategy, PowerBI, etc.",https://tinyurl.com/ybrwd7ag
Analista de Banco de Dados – SQL Server,"São Paulo, SP",Algar Tech,Foco em Desenvolvimento de Scripts em SQL/SQL Server para criar relatórios e testes de qualidade de dados baseados em dados mestre SAP;,https://tinyurl.com/y9e8ywaa
[RJ] Engenheiro de Dados / Analista de Power BI,"Rio de Janeiro, RJ",RADIX Engenharia e Software,Implementação de transformações de dados para elaboração de indicadores.Conhecimento das soluções de manipulação de dados da Azure.Que tal fazer parte disso?,https://tinyurl.com/y8lh7uq7
Analista de Dados Técnicos de E&P - Júnior,"Rio de Janeiro, RJ",Spassu Tecnologia,Realização de consultas de dados geológicos através de softwares Petrobank e PowerExplorer;Manipulação de dados digitais de poços ligados à prospecção…,https://tinyurl.com/y9aqt5ne
Senior Consultant - Analista de Dados,"São Paulo, SP",Provider It,"Profundo conhecimento em Modelagem de Dados;Profundo conhecimento em Linhagem de Dados;Conhecimento de estratégia de negócio para como DADO, ou seja, ver a…",https://tinyurl.com/yayr3quj
Analista de Dados pleno (remoto) Ruby,"São Paulo, SP",GeekHunter,Conhecimento em escrita de casos de teste com BDD;Buscamos QA para atuar em nosso time de Qualidade na execução do conjunto de atividades que tentam garantir…,https://tinyurl.com/yd2ncyfz
Analista de Marketing - Dados e Inteligência,"Maringá, PR",brMalls,Desenvolver estratégias em conjunto com o time de Marketing/CRM - Holding para captura de leads qualificados e enriquecimento de dados do consumidor;,https://tinyurl.com/y927v56o
Analista de Infraestrutura Banco de Dados Sênior,"Brasília, DF",Central IT,Analista de Infraestrutura Banco de Dados Sênior.Ampla experiência em Administração e sustentação de banco de dados suportados pelas plataformas Oracle (11g e…,https://tinyurl.com/y8xjgt39
Consultant - Analista de Dados,"São Paulo, SP",Provider It,"Profundo conhecimento em Modelagem de Dados;Profundo conhecimento em Linhagem de Dados;Conhecimento de estratégia de negócio para como DADO, ou seja, ver a…",https://tinyurl.com/ydxzkq34
ANALISTA DE BANCO DE DADOS,"São Luís, MA",None,"Construção de fórmulas de benefícios.Atividades: Suporte ao módulo de folha de pagamento.Levantamento de Requisitos funcionais, Não funcionais.",https://tinyurl.com/ybmdg5b6
Analista Programador Sr (Analista de Dados e BI),"São Paulo, SP",Stefanini,"Tempo de Experiência: 5 anos e 0 meses.(Superior Completo) Engenharia da Computação, Ciências da Computação, Análise de Sistemas, Matemática ou Sistemas da…",https://tinyurl.com/y9eamlcs
Estágio Analista de Dados,Remoto,A3Data,Apoiar em processos de construção de ambientes de dados;Apoiar na estruturação de extração e carga de dados;Apoiar na formulação de problemas de dados;,https://tinyurl.com/y84qgosa
Analista de Dados Jr,"Indaiatuba, SP",CORPUS,"Responsável pelos processos geração de relatórios, manutenção de dashboards, análises dos dados utilizando ferramentas estatísticas para gerar informações com…",https://tinyurl.com/yblwba8n
ANALISTA DE DADOS,"Barueri, SP",DHL,"Obter dados de fontes primárias ou secundárias e manter bancos de dados/sistemas de dados.Desenvolver e implementar bancos de dados, sistemas de coleta de…",https://tinyurl.com/y83o4km3
Analista de Dados,"São Paulo, SP",HCOR,"Conhecimento de processos de dados e analytics;Criar e manter visualizações interativas avançadas por meio da interpretação e análise de dados, integrando…",https://tinyurl.com/y7ocqg2t
Analista de Dados Sênior,Remoto,Supero Tecnologia,Será sua responsabilidade a construção e manutenção de pipelines de dados; Definição e implementação de arquiteturas escaláveis de processamento de dados;…,https://tinyurl.com/y96rozma
Pessoa Analista de Dados,"Rio de Janeiro, RJ",Passei Direto,"Conhecimento básico de ferramentas de processamento de dados (AWS, Airflow);+ 1 ano de experiência trabalhando com análise de dados;",https://tinyurl.com/y7jqbxmv
Analista de Governança de Dados | Pleno/Sênior,Brasil,Compasso UOL,Experiência na implementação de disciplinas de Governança de Dados.Atuar próximo das áreas de negócios de forma a garantir alinhamento da estratégia de dados…,https://tinyurl.com/y6ugmppo
ANALISTA DE DADOS PLENO,"Uberlândia, MG",ALGAR TECH,Atuar na execução de captura de dados e processo de ingestão de dados;1 ano como analista jr ou Experiência de 3 anos como analista MIS (Mercado).,https://tinyurl.com/yc28tmjo
Analista de Banco de Dados Jr (Parametrização),"Salvador, BA",Job Boards,Testes e execução de scripts para correção e manipulação de dados em ambiente de produção;Análise de correção de incidentes e defeitos de software;,https://tinyurl.com/y9fhghhp
Analista de Dados,"Florianópolis, SC",Delivery Much,"Conhecimento de ferramentas básicas de análise de dados e/ou de entrega de relatórios, como Power BI, Google Analytics, AppsFlyer;Como será seu dia a dia:",https://tinyurl.com/yceyv2m2
Analista de Dados e CRO (eCommerce),Brasil,Sallve,"Sua missão será propor e executar os testes AB do site, além de mergulhar nos dados de conversão modelando dashboards e acompanhar de perto nosso projeto de…",https://tinyurl.com/ybdprfk5
Analista de Dados,"São Paulo, SP",RankMyAPP,Experiência com gestão de dados.Conhecimento de tracking links e postbacks (enviar e receber os dados através de parâmetros e macros);,https://tinyurl.com/yb3gayqh
Analista de Dados,"Porto Alegre, RS",Lojas Renner,"Modelagens estatísticas voltadas para o cliente, otimização de segmentações, análises de perfis de base, criação de alertas de performance e análises…",https://tinyurl.com/y6vbwfun
Analista de Dados Pleno - 100% Remoto,Brasil,Deal Technologies,"Tratamento de bases de dados e apresentação dos mesmos.Preferencialmente em ferramentas de big data (Hive), podemos acompanhar também SAS caso não seja…",https://tinyurl.com/y96trrqo
Analista de Canais de Relacionamento (Foco em Dados),"Porto Alegre, RS",Sicredi,Habilidades e temas de conhecimento em: Mercado financeiro e seus produtos e serviços; Gestão de Projetos; Base técnica para relacionamento com a equipe de TI;…,https://tinyurl.com/y79gqjta
ANALISTA DE DADOS - SÃO LUÍS,"São Luís, MA",OEmprego,Horário: De segunda a sexta e escala de revezamento aos finais de semana.Experiência na gestão de hospitalar;Imputar os dados no forms/App.,https://tinyurl.com/yd9xos82
Analista de Dados - Função: Analista de Suporte da Área,"São Paulo, SP",The Church of Jesus Christ of Latter-day Saints,"Técnicas de Análise de Processos.Noções em lógica de programação, arquitetura de sistemas, tecnologia da informação e gestão de processos de negócio.",https://tinyurl.com/y8bxmpg2
ANALISTA DE DADOS E NEGÓCIO (FARMACÊUTICO) - BV,"Brasília, DF",Buscar Vagas,"Realizar análise, atualização e manutenção periódica de insumos faturáveis dos materiais e medicamentos, através dos sistemas de estoque e faturamento.",https://tinyurl.com/y99dkm47
Pessoa Analista de Privacidade e Proteção de Dados,"Florianópolis, SC",RD Station,"Participar ativamente do Programa de Privacidade da RD, através do mapeamento dos dados pessoais e seus diagnósticos de risco, como também confeccionar…",https://tinyurl.com/ycwns8lo
Analista de Visualização de Dados Sr,"Recife, PE",Avanade,"Na implementação de planos de projeto em torno de ferramentas de relatórios, painéis de informações, geradores de dados e outros portais ou recursos de…",https://tinyurl.com/y6ut3vkt
Dados da vaga Analista De Comunicação E Marketing - Atendime...,"Porto Alegre, RS",PONTIFICIA UNIVERSIDADE CATOLICA DO RS-CAMPUS POA...,Capacidade de gerenciamento de projetos de comunicação e marketing;Experiência na elaboração de soluções de comunicação e marketing;,https://tinyurl.com/yd828bvb
Analista De Sistemas - Engenharia De Dados,"Jaraguá do Sul, SC",WEG Germany GmbH,"Participar da análise e desenvolvimento de soluções com foco em análise de dados, sendo responsável pela coordenação de projetos de software, considerando o…",https://tinyurl.com/y7m3zjb4
Analista de Dados Pleno | Card Serviços,"São Paulo, SP",PicPay,"Desenvolvimento de soluções de Self - Service de dados;Você será a ""força"" de dados dentro de cada projeto e deve ser capaz de entregar de ponta a ponta as…",https://tinyurl.com/yc4zwmq2
Dados da vaga Analista De Comunicação Interna em RS,"Porto Alegre, RS",PONTIFICIA UNIVERSIDADE CATOLICA DO RS-CAMPUS POA...,"Gerenciar canais de comunicação permanente com colaboradores, monitorando indicadores de resultado;Experiência consolidada em gestão de projetos/planos…",https://tinyurl.com/y8nt39ok
Analista de Dados,"São Paulo, SP",Curriculum.com.br,Cientista/Analista de Dados- Qualidade Médica Gerar análises e insights de oportunidades de negócios que tragam valor para nosso paciente; Gerar de indicadores…,https://tinyurl.com/ydyc6rxp
Analista de Dados ( Financeiro ),"Belo Horizonte, MG",Hotmart,Experiência em análise de dados para geração de relatórios e acompanhamento dos indicadores da diretoria de Operações Financeiras;.O que esperamos de você?,https://tinyurl.com/ycjj4fey
Analista De Rede E Comunicação De Dados – Porto Alegre – RS...,"Porto Alegre, RS",Buscar Vagas,"Atribuições: Suporte técnico informático, desempenhando atividades como manutenção de equipamentos, instalação e configuração de software e sistemas utilizados…",https://tinyurl.com/y9erzj6n
Analista de Dados/Analytics - Techfin,"São Paulo, SP",TOTVS,Arquitetar a estrutura de dados para suportar alto volume de dados com alta performance.Criar e gerenciar pipelines de criação de variáveis e enriquecimento de…,https://tinyurl.com/ybo42zl4
Analista de Banco de Dados (Software),"Ribeirão Preto, SP",Integrarh Consultoria e Gestao de Pessoas LTDA - M...,"Assegurar o controle, administração e estabelecimento dos modelos lógicos e físicos da estrutura do banco de dados da empresa; - Administrar a estrutura do…",https://tinyurl.com/y9t4cqjh
Analista de Banco de Dados PL,"Porto Alegre, RS",Pmweb,Modelagem de dados em banco de dados SQL Server;Experiência em desenvolvimento e manutenção de rotinas de integração de dados utilizando SQL Server;,https://tinyurl.com/ycf4a6s9
Analista de Dados Sênior,"Curitiba, PR",Conquest One,"Conhecimento em banco de dados e linguagem SQL;Experiência de pelo menos 3 anos na construção de dashboards em Tableau, com extração de dados de diferentes…",https://tinyurl.com/y75szc86
Analista de Banco de Dados,"Belo Horizonte, MG",VISAO ACESSORIA,Diretrizes de distanciamento social aplicadas.Protetor facial nos locais de trabalho.Conhecimentos em desenvolvimento e manutenção criação de consultas.,https://tinyurl.com/yd7s48cc
ANALISTA DE BANCO DE DADOS SQL,"Juiz de Fora, MG",CBRH Consultoria,"Banco de Dados; SQL; Identificação e análise de bugs; Ferramentas de Service Desk ; Sistemas operacionais Windows; Conhecimento em Spon (Pentaho), Conceitos de…",https://tinyurl.com/y98f2g9p
Analista de Conversão de Dados,"Belo Horizonte, MG",AIX SISTEMAS LTDA,"Realizar reconstruções de base de dados, correções de erros e demais serviços relacionados aos bancos de dados..Experiência anterior: Migração de dados.",https://tinyurl.com/yaekfoje
Analista de Dados SR (Web Analytics),"Curitiba, PR",MadeiraMadeira,Habilidade de Resolução de Problemas.Conhecimentos em bancos de dados não relacionais.A MadeiraMadeira atingiu o status de Unicórnio em 2021 e colocou o…,https://tinyurl.com/y7rgwbym
Analista de Dados - Qualidade e Modelagem de Dados,"Belo Horizonte, MG",Hotmart,"Contribuir para a arquitetura de processamento de dados e manutenção de nossos pipelines de dados;Complementando suas atividades enquanto analista de dados,…",https://tinyurl.com/y7ahfys6
Analista De Dados OLAP - DV,"Brasília, DF",Divulga Vagas,Mínimo de 5 (cinco) anos no uso de soluções analíticas(OLAP) Microstrategy e/ou PowerBI; II – Conhecimentos curriculares comprovados de: a) Estruturação de…,https://tinyurl.com/y7klknru
Dados da vaga Analista De Comunicação E Marketing - Conteúdo...,"Porto Alegre, RS",PONTIFICIA UNIVERSIDADE CATOLICA DO RS-CAMPUS POA...,"Sólida experiência em gestão e produção de conteúdo para plataformas digitais.Experiência em produção e performance de conteúdo, SEO e SEM.",https://tinyurl.com/yco2md74
Estágio – Analista De Dados – Porto Alegre – RS - BV,"Porto Alegre, RS",Buscar Vagas,"> Alimentar banco de dados com novas informações;Cursando alguma das áreas: Técnico de Informática, Graduação em: Análise de Sistemas Sistemas de Informação,…",https://tinyurl.com/ycx5wfh3
Analista Engenharia de Dados Sr.,"São Paulo, SP",Avanade,Com a manipulação de dados e criação de processos de ETL.Modelar os dados em um ambiente de BigData / DataWareHouse.Amar a área de tecnologia.,https://tinyurl.com/y8cfzvez
Analista de Dados l - Data Center - Junior,"Blumenau, SC",Selecionar Talentos,"Suporte a equipe de desenvolvimento em padronizações de objetos e dicionários de dados;Responsabilidades Responsável por definir, propor e manter o modelo de…",https://tinyurl.com/y9yefgbz
ANALISTA DE DADOS BI - SUPERIOR COMPLETO,"Fortaleza, CE",None,"Prover análises de indicadores utilizando conceitos de estatística através do Planner, dentre outros.Sistemas de Informação ou correlatas.",https://tinyurl.com/y8urln34
ANALISTA DE BANCO DE DADOS PLENO - DV,"Brasília, DF",Divulga Vagas,"2.Atualizar e manter o modelo de dados.Compartilhamento e integração dos dados; A Combinar Profissional deve ser capaz de planejar, documentar, gerenciar e…",https://tinyurl.com/yd36aurr
ANALISTA DE DADOS,"Campinas, SP",None,Vivência em manipulação de banco de dados (SQL) – Atuação na área de Business Intelligence e/ou Data Warehouse – Experiência com ferramentas de visualização de…,https://tinyurl.com/yccgne6y
Analista de Dados Pleno - Interlagos,"São Paulo, SP",None,Tarefas pertinentes a rotina de Analista de Dados Pleno.Empresa de tecnologia admite Analista de Dados Pleno em São Paulo (Interlagos) para atuar em Tempo…,https://tinyurl.com/y2jtrks7
Analista SR de Dados - Fintech Operations,"São Paulo, SP",Mappit,Conhecimento básico de banco de dados é um diferencial.Realização de treinamentos e confecção de materiais de apoio.Conhecimento do mercado de pagamentos.,https://tinyurl.com/y9pkc864
Analista de Dados,"São Paulo, SP",Dentsu Aegis Network,Implementando técnicas de visualização de dados.Sólida experiência de trabalho em projetos de banco de dados.Gerenciando dados de múltiplas fontes.,https://tinyurl.com/y8aeyt8e
Analista de Dados Pl,"São Paulo, SP",B2W Digital,"Buscamos Analista de Dados para atuar na área de Qualidade, na análise de dados e geração dos indicadores de acompanhamento de Produtos & Serviços.",https://tinyurl.com/ya9jd6n4
Analista de Dados,"Lopes, SP",ProjecTI,Construção de visualizações de dados através de Dashboards e outras formas de relatórios automatizados.Descobrir e avaliar a utilidade de novas fontes de dados…,https://tinyurl.com/y3cjvjp7
Analista de Dados (BI),"São Paulo, SP",Semantix,Desenvolvimento contará com etapas de desenvolvimento de ciência de dados com a presença de cientista para auxiliar na construção de painéis de visão…,https://tinyurl.com/yxbgkv6x
Analista de Dados - Central Botafogo/RJ,"Rio de Janeiro, RJ",Escola Eleva,Atualizar e automatizar nossas bases de dados;Plano de saúde e odontológico.Estamos em busca de um(a) Analista de Dados para atuar na nossa Central em…,https://tinyurl.com/y74rrafq
Analista Pleno de Banco de Dados - Bda,"Maringá, PR",CREFAZ FINANCIAMENTOS E INVESTIMENTOS,"Administração do ambiente de banco de dados em produção, ambiente de missão crítica, interagindo de maneira reativa e pró ativa junto às demais áreas da empresa…",https://tinyurl.com/y23akxna
Analista de Banco de Dados (SQL),"Ribeirão Preto, SP",Integrarh Consultoria e Gestao de Pessoas LTDA - M...,Instalar e gerenciar o banco de dados e seus usuários com segurança; Efetuar e recuperar backups e restore e atender demandas de indisponibilidade e performance…,https://tinyurl.com/y8tscxhm
Analista de Banco de Dados Pleno,"São Paulo, SP",Genial Externo,"Administração de bancos de dados (Oracle, SQL Server e MongoDB) em ambiente crítico;Espírito de equipe e vontade de aprender;Apoio à equipe de sistemas;",https://tinyurl.com/y994urra
Analista de Dados BI,"Fortaleza, CE",None,"Prover análises de indicadores utilizando conceitos de estatística através do Planner, dentre outros.Criar métricas, KPIs, extrair , tratar e comparar dados…",https://tinyurl.com/yaaemts3
Analista de Dados,"Curitiba, PR",James Delivery,"Fornecer conhecimento técnico em estruturas de armazenamento de dados, mineração de dados e limpeza de dados.Garantir a qualidade de dados importados.",https://tinyurl.com/yc5aznhv
Analista de Dados de Negócios,"Chácara Santo Antônio, SP",Global Empregos,"Reúne, classifica e analisa inteligência de uma variedade de fontes de campo e sistemas de informação.Conciliação de dados com equipe Global.",https://tinyurl.com/yyvfg32w
Analista de Dados (Marketing),"São Paulo, SP",Shopee,"Vivência na manipulação de grandes bases de dados, com o propósito de gerar os insights para a nossa área de Marketing.Quais são os pré requisitos?",https://tinyurl.com/ycmfeozb
Analista de Dados Google Analytics pleno (remoto),Brasil,GeekHunter,"Para isso, contam com a inteligência e agilidade do time da InCuca para escalar e garantir um ambiente de alta performance, afim de liderar os mercados em que…",https://tinyurl.com/y25tg457
ANALISTA DE DADOS EPIDEMIOLÓGICOS - DV,"Brasília, DF",Divulga Vagas,"Atividades: Realizar análise de informações em saúde, leitura e codificação de prontuário, validação de banco de dados, análise de relatórios, entre outras…",https://tinyurl.com/yyht9eff
Analista de Arquitetura de TI III - Dados 2,"Blumenau, SC",Mazzatech,Conhecimento em ferramentas de integração com ênfase em soluções de iPaaS.EXPERIÊNCIA: Requisitos desejáveis / diferenciais: · Conhecimento em padrões de…,https://tinyurl.com/y2xonu8d
Analista de Dados - Pleno,"São Paulo, SP",MAGNA SISTEMAS,"Conhecimento em ferramentas para gestão de dados (ciclo de vida de dados, replicações de dados real time, mascaramento de dados);Local de trabalho:São Paulo.",https://tinyurl.com/y7unb6ta
Analista de Dados,"Betim, MG",Grupo Sada,O Grupo SADA está presente na vida de milhões de pessoas por meio de empresas que atuam em seis segmentos.Goste de trabalhar em equipe e se comunique bem;,https://tinyurl.com/y2kyb6l7
Analista/Cientista De Dados Pleno - BV,"São Paulo, SP",Buscar Vagas,"Desenvolvimento de automatizações utilizando Phython; Estruturação de base de dados para análise comerciais; Desenvolvimento de Dashboards, automação e análise…",https://tinyurl.com/yctyzqn7
