Cargo,Local,Empresa,Descrição,Rating
ANALISTA DE DADOS JR - VILA ARISTARCHO,"Presidente Prudente, SP",Jobbol,"Empresa de Transporte de Passageiros admite Analista de Dados Jr em Presidente Prudente (Vila Aristarcho) para atuar em Tempo integral, Comercial. Apoiar a…Postado há 30+ dias·",Sem informacao
ANALISTA DE DADOS,"Osasco, SP",LETS,"
Habilitar a Cultura orientada a dados, por meio de análises que permitam a melhor tomada de decisão;
Entender tecnologias existentes, para resolver problemas…
Postado há 30+ dias·",Sem informacao
ANALISTA DE DADOS PLENO | SQUAD CRO,Home office,Contabilizei Carreira Tech,"
Conhecimento intermediário de bancos de dados relacional (SQL);
﻿Reunir, modelar, interpretar e analisar dados; explicando as variações e tendências, agregando…
Postado há 24 dias·",Sem informacao
ANALISTA DE DADOS PARA PROJETO SAP (ETL) - PRESENCIAL EM SÃO...,"São Paulo, SP",Otg,"
Crias Extratores SAP para envio de dados para um ambiente AWS;
Atuar com viés de arquitetura para novos projetos;
Proficiência e cooperação com o time;
Postado há 26 dias·","2,7"
ANALISTA DE DADOS DE NEGÓCIOS,"São Paulo, SP",Fortbras,"Quer fazer parte de um time Fort e impulsionar a sua carreira? A Fortbras é formada por 14 marcas regionais (Ambra Pneus, Atacado União, BHZ, Hipervarejo,…Postado há 17 dias·","4,2"
ANALISTA DE DADOS PLENO | INTELIGÊCIA EM DADOS DE OPERAÇÕES...,Home office,Globo,"
Os seus dados pessoais serão utilizados para fins de seleção de candidatos para preenchimento das vagas abertas na Globo.
Incrível em Excel e Power Point;
Postado há 12 dias·","3,5"
ANALISTA DE DADOS E BUSINESS INTELLIGENCE MSTER,"Brasília, DF",Digisystem,"
MCSE: Data Management and Analytics.
Oracle Business Intelligence Foundation Suite 11g Certified Implementation Specialist.
CSM® pela Scrum Alliance.
Postado há 30+ dias·","3,7"
