Cargo,Local,Empresa,Descrição,Link
CIENTISTA DE DADOS,"Rio de Janeiro, RJ",CASA&VIDEO,"Vivência em analisar dados desestruturados (data munging), Data Ingestion, Web Scrapping, ambientes de Big Data, Containers e APIs;",https://tinyurl.com/y3gb9x3q
CIENTISTA DE DADOS,"Manaus, AM",Eldorado,Você tem Paixão por Análise de Dados? Tem conhecimento em Linguagem SQL? Essa oportunidade pode ser para você. #VemSerEldorado Requisitos: Formação…,https://tinyurl.com/y3tf8va4
Cientista de Dados Machine learning,"São Paulo, SP",GeekHunter,"Geração de reports e dashboards.Transformar dados em insights para o business.Endereço Rua Joaquim Floriano 960, 16 andar.",https://tinyurl.com/y5klckwm
Cientista de Dados / Data Scientist / Desenvolvedor Machine...,"Goiânia, GO",EasyCrédito,Ingestão de Dados & Data Mining;O EasyCrédito é uma Fintech que conecta pessoas que dispõem de pouco acesso a serviços financeiros com empresas que oferecem…,https://tinyurl.com/y45l9j64
Cientista de Dados - Analytics,"São Paulo, SP",HAYS,"Conhecimento em Amazon Kinesis, Glue, Athena requerido; • Administração de bucket S3 e instâncias AWS EC2 para execução de componentes da plataforma de…",https://tinyurl.com/y4etl6z8
Cientista de Dados Python Pleno (Remoto),Brasil,GeekHunter,"Nosso maior diferencial está em como selecionamos e formamos pessoas.Assim, conseguimos sustentar um modelo que se renova com facilidade, oferecendo a base…",https://tinyurl.com/yyvguf6y
Cientista de Dados,"Curitiba, PR",hilab,Experiência desde o concebimento até a implantação de projetos de Data Science;Implementar projetos de Data Science na Hilab;,https://tinyurl.com/yxuqlbwc
Cientista de Dados Pleno | Inteligência Artificial,"São Paulo, SP",PicPay,Conhecimento em banco de dados e linguagem SQL;Capacidade de traduzir um problema de negócios em um problema de Data Science;,https://tinyurl.com/y6ox6qzk
CIENTISTA DE DADOS SÊNIOR,"Campinas, SP",Eldorado,"Sólida experiência com aplicação de técnicas de Aprendizado de Máquina (classificação, regressão, agrupamento, recomendação) em soluções de mercado;",https://tinyurl.com/y572sj52
Cientista de Dados Júnior | Inteligência Artificial,"São Paulo, SP",PicPay,Conhecimento em banco de dados e linguagem SQL;Capacidade de traduzir um problema de negócios em um problema de Data Science;,https://tinyurl.com/y6reck5g
Cientista de Dados Sênior | Inteligência Artificial,"São Paulo, SP",PicPay,Conhecimento em banco de dados e linguagem SQL;Capacidade de traduzir um problema de negócios em um problema de Data Science;,https://tinyurl.com/y2ur9cjy
Cientista de Dados Pleno,"Brasília, DF",Ernst & Young,"Conhecimento técnico de infraestruturas de dados (bancos de dados relacionais, não relacionais, etc.) e Big Data.Conhecimento em tecnologias para IA;",https://tinyurl.com/y2ngrvlc
Pessoa Cientista de Dados Sênior (Vaga Remota),"Manaus, AM",Carreiras Méliuz,Habilidade analítica para sintetizar regras de negócio e consolidar dados que irão guiar tomadas de decisão.Ter atuado em projetos com grandes volumes de dados…,https://tinyurl.com/y3y8jugn
Cientista de dados sênior,"São Paulo, SP",Itaú Unibanco,Programação Python voltada para métodos de machine learning (Aplicação de modelagem).Conhecer e atuar com a engenharia de machine learning.,https://tinyurl.com/yykwvcco
Anl Prevencao Fraude (Cientista de Dados) PL/SR,"São Paulo, SP",Santander Brasil,"Conhecimento em manipulação de grandes volumes de dados e linguagens de programação (SQL, Python, SAS e Excel);",https://tinyurl.com/y4rxk9fp
Cientista de Dados,"Rio de Janeiro, RJ",B2W Digital,"O núcleo de Data Science dentro do time de MarTech é responsável por criar modelos estatísticos para entender padrões de navegação dos usuários em nossos sites,…",https://tinyurl.com/yxc68tmn
[BH] Cientista de Dados,"Belo Horizonte, MG",RADIX Engenharia e Software,"Executar projeto inovador de análise de imagens para prevenção de incidentes em barragen.Conhecer Machine Learning/Análise de Dados, mais especificamente os…",https://tinyurl.com/y5xltfl9
Cientista de Dados,"São Paulo, SP",Comunidade Cognitivo.ai,"Criação de features para otimização de modelos.Participação de todas as interações com o time (sprint plannings, cerimônias e outros touchpoints definidos…",https://tinyurl.com/yyxkkeev
Cientista de Dados | Presencial ou Home Office,"Blumenau, SC",Ambev Tech,"Se você sabe transformar dados em informações de valor e quer fazer parte de uma empresa dinâmica, precisamos conversar! Estamos com vagas abertas para…",https://tinyurl.com/y3jk8jt2
Cientista de Dados Sr,"São Paulo, SP",Stefanini,"Atuar em projetos de médio e grande portes e apoiar o time de Business Analytics na entrega.Stakeholders Internos: Comercial, Produtos, Operações, Tecnologia e…",https://tinyurl.com/y3htm6j4
[REMOTO] Cientista de Dados,"São Paulo, SP",RADIX Engenharia e Software,Experiência em linguagens estatísticas ( R) é desejável;,https://tinyurl.com/y3s66kcp
[RJ] Cientista de Dados,"Rio de Janeiro, RJ",RADIX Engenharia e Software,Temos sede por transformar nosso conhecimento técnico-científico em respostas para problemas complexos do mundo da engenharia e software. Precisamos de…,https://tinyurl.com/yzeo7dw8
[RJ ou SP] Cientista de Dados Junior,"Rio de Janeiro, RJ",RADIX Engenharia e Software,Experiência de pelo menos 1 ano em linguagens de programação estatísticas (python ou R) e as principais bibliotecas de machine learning.,https://tinyurl.com/y4rcz6bm
Cientista de Dados,"São Paulo, SP",Reachr Soluções Inovadoras em RH,Ter flexibilidade em alternar tarefas;,https://tinyurl.com/y6ora3ge
Cientista de Dados - Pleno,"São Caetano do Sul, SP",OEmprego,"- Irá medir, controlar, monitorar e analisar problemas de qualidade dos dados; - Definir e automatizar as regras de qualidade de dados, controles e alertas em…",https://tinyurl.com/y447k89g
Cientista de Dados,"São Paulo, SP",Braskem,"Apply analytics, artificial intelligence, machine learning, big data, IoT, and cloud technology to identify and execute on efficiency improvement opportunities…",https://tinyurl.com/y4rjkkcu
Cientista de Dados,"Rio de Janeiro, RJ",FGV - Fundação Getulio Vargas,Conhecimento de banco de dados não estruturados e estruturados (SQL/NoSQL);Conhecimento de técnicas de modelagens estatísticas e machine learning;,https://tinyurl.com/y4mesdg3
Estágio em Data Analytics / Cientista de dados 01 VAGA,"São Paulo, SP",None,2 - Estágio em Data Analytics / Cientista de dados.Vagar URGENTES para o banco digital Rino digital.Para trabalhar em São Paulo - Vila Mariana.,https://tinyurl.com/y4wocr9o
