Cargo,Local,Empresa,Descrição,Link
Analista de Dados,"São Paulo, SP",IS Entrega,Implementar novas metodologias de análise de dados.Domínio em banco de dados.Além de supervisionar a implantação e armazenagem de dados.,https://tinyurl.com/y3x29vad
Analista de Dados (Conteúdo e Pesquisa),"Rio de Janeiro, RJ",PEBMED,"Responder perguntas de negócio através de consultas SQL ad-hoc, bem como através de análises em planilhas e outras fontes de dados;Então essa vaga é pra você!",https://tinyurl.com/yya9dwpa
Analista de Dados - Sênior - SQL & QlikView.,"São Paulo, SP",Semantix,"Quer impactar bilhões de vidas com dados?Solucionar problemas com modelos de dados e painéis existentes.Extrair, transformar e carregar dados de várias fontes…",https://tinyurl.com/y4vssrex
Analista de Dados júnior,"Uberlândia, MG",GeekHunter,"Formatar/instalar periféricos em equipamentos (desktops / notebooks), Utilização de imagens para replicar em equipamentos, Reset de senha de usuários no AD,…",https://tinyurl.com/yyvzff8c
Analista de Integração de Dados,Estado do Rio de Janeiro,Rheserva,Ao menos 3 anos de experiência em projetos de integração de dados.Estamos com oportunidades para profissionais experientes em projetos de integração e…,https://tinyurl.com/y4yj4ece
Analista de Dados Sênior (Vaga Remota),"Belo Horizonte, MG",Carreiras Méliuz,Procuramos uma pessoa analista de dados sênior para nos ajudar a escalar nossas análises e fortalecer nossa cultura data-driven.﻿Vem fazer parte do nosso time?,https://tinyurl.com/y2vzpwyn
Analista de Produtos de Dados Sr,"São Paulo, SP",Page Personnel,Análise de grande volume de dados para geração de conteúdos que criem novas oportunidades de negócio;Preparação de dados: o processo de conversão de dados…,https://tinyurl.com/yaz55laf
Analista Dados - Rio de Janeiro,"Rio de Janeiro, RJ",Atento Corporate,Realizar integração e pesquisa de informações em banco de dados;Realizar levantamento de requisitos / mapeamento de processos;,https://tinyurl.com/y5lyc9rp
Analista de Banco de Dados,"São Paulo, SP",FlexVision,"Pela criação, instalação, monitoramento, reparos e análise de estruturas de um banco de dados.Após, o local de trabalho será no Centro de São Paulo.",https://tinyurl.com/yyt4te2l
Analista de Dados SQL (remoto),"Joinville, SC",GeekHunter,"Vivência com ferramentas de mercado para implantação de qualidade de dados ou de gestão de dados mestres (MDM);Como Analista de Dados, você irá:",https://tinyurl.com/yynqyq4j
Analista de Banco de Dados Pleno,"Barueri, SP",Conquest One,Migração de base de dados;Implantação de banco de dados em cloud pública.Conhecimentos sólidos sobre a arquitetura de banco de dados;,https://tinyurl.com/y23x8y9d
Analista Engenharia de Dados Sênior,"São Paulo, SP",Conquest One,"Desenvolvimento de pipeline de dados na nuvem.Entendimento de demanda de diversas áreas da empresa.Conhecimentos em banco de dados, com SQL avançado e…",https://tinyurl.com/y3559qf5
ANALISTA DE BANCO DE DADOS,"Porto Alegre, RS",Stefanini,"Buscamos um profissional que tenha um perfil de analista, com viés de infraestrutura (saiba trabalhar com implantação e migração de ferramenta), e tenha…",https://tinyurl.com/y2vrkosx
Analista de Banco de Dados Pleno,"Rio de Janeiro, RJ",None,Vaga de Emprego:Analista de Banco de Dados Pleno.Conhecimento em sistemas de ERP e em administração de Banco de Dados Oracle;,https://tinyurl.com/y65daotd
ANALISTA DE DE PRIVACIDADE DE DADOS PLENO,"Barueri, SP",C&A,"Experiência em condução e implementação de projetos de privacidade de dados;Apoiar projetos de estruturação de proteção de dados, efetuando atividades…",https://tinyurl.com/y23lfad4
Analista de Dados Sr - RBrasil,"São Paulo, SP",Atento Corporate,"Atuar em processos de modelagem de dados com foco em BI;Desejável com Infra em Banco de dados, metodologias ágeis, conhecimento em modelos de negócios de…",https://tinyurl.com/y39zaxo4
Analista de Dados Power BI (remoto),"Belo Horizonte, MG",GeekHunter,"Coleta de dados, desenvolvimento de consultas e elaboração de relatórios e dashboards;Vivência na aplicação de modelos estatísticos em grandes volumes de dados…",https://tinyurl.com/y5xpujps
Analista de Dados,"Porto Alegre, RS",Lojas Renner,"Foco em relatórios e análises de resultado, Modelagens estatísticas voltadas para clientes, otimização de segmentações, análises de perfis da base, criação de…",https://tinyurl.com/y4rpsmo2
Analista de Dados - Power Center / MDM/IICS - remoto,"São Paulo, SP",HOLDEN Recruiting Talents,O profissional fará parte do time de extração e integração de dados de grande empresa no mercado.Empresa de Consultoria de Grande porte.BI( mais de 3 anos);,https://tinyurl.com/yyz3kxl5
Analista de Operações (Dados),"Curitiba, PR",Olist,"Você será responsável pelo desenvolvimento, manutenção e melhoria de dashboards, análise de dados, elaboração e automações de scripts de baixa a média…",https://tinyurl.com/y6trn86y
Analista de Dados Pleno (Specialist II),"São Paulo, SP",TransUnion,"Cuidar do processo de ingestão de dados.Experiência em SQL, ou outras linguagens de banco de dados similares.Dar suporte na integração de novas fontes.",https://tinyurl.com/y6t2v8z6
