Cargo,Local,Empresa,Descrição,Link
Anl Prevencao Fraude (Cientista de Dados) PL/SR,"São Paulo, SP",Santander Brasil,"Conhecimento em manipulação de grandes volumes de dados e linguagens de programação (SQL, Python, SAS e Excel);Aqui você pode ser quem você é!",https://tinyurl.com/y4rxk9fp
Cientista de Dados,"Rio de Janeiro, RJ",B2W Digital,Tudo isso através de Modelagem de Dados e técnicas de Machine Learning!Realizar forecast de vendas de produtos;Você terá a oportunidade de:,https://tinyurl.com/yxc68tmn
Cientista de Dados,"São Paulo, SP",Comunidade Cognitivo.ai,"Criação de features para otimização de modelos.A posição de Cientista de Dados irá atuar nos nossos projetos, de forma freelancer e 100% remota.",https://tinyurl.com/yyxkkeev
[BH] Cientista de Dados,"Belo Horizonte, MG",RADIX Engenharia e Software,Limpeza e análise estatística de dados;Executar projeto inovador de análise de imagens para prevenção de incidentes em barragen.Plano de Saúde e Odontológico;,https://tinyurl.com/y5xltfl9
Cientista de Dados - Pleno | Presencial ou Home Office,"Blumenau, SC",Ambev Tech,"Apresentar os resultados de modelos de ciência de dados de forma compreensível para as áreas de negócios, sem perder o rigor científico;",https://tinyurl.com/y3jk8jt2
[REMOTO] Cientista de Dados,"São Paulo, SP",RADIX Engenharia e Software,"Limpeza e análise estatística de dados;Além da experiência de crescimento e troca de conhecimento, os nossos colaboradores têm acesso a:",https://tinyurl.com/y3s66kcp
Cientista de Dados Sr,"São Paulo, SP",Stefanini,"Atuação na área de Pré-vendas com foco em tecnologias de Business Analytics, realizando o entendimento de necessidades de clientes, arquitetura de soluções…",https://tinyurl.com/y3htm6j4
[RJ ou SP] Cientista de Dados Junior,"Rio de Janeiro, RJ",RADIX Engenharia e Software,"Experiência em análise, limpeza e processamento de dados de dados ruidosos para diversas aplicações;Experiência com deployment de modelos e principais…",https://tinyurl.com/y4rcz6bm
[RJ] Cientista de Dados,"Rio de Janeiro, RJ",RADIX Engenharia e Software,"Experiência em análise, limpeza e processamento de dados de dados ruidosos;Propor técnicas de processamento de dados e treinamento de algoritmos preditivos;",https://tinyurl.com/yzeo7dw8
Cientista de Dados - Pleno,"São Caetano do Sul, SP",OEmprego,Interagir com os consumidores e originadores de dados para analisar e resolver problemas de qualidade de dados;| Ensino: . | Turno: Integral.,https://tinyurl.com/y447k89g
Cientista de dados (PI),"Campinas, SP",OEmprego,"Trabalhar com ciência de dados, em análise e modelagem preditiva.. Cargo: Cientista de dados (PI) | Salario: A combinar.| Ensino: . | Turno: Integral.",https://tinyurl.com/y66cwh8j
Cientista de Dados Pleno,"São Paulo, SP",Porto Seguro,"Encontrar a solução de cada tipo de problema, muito antes de treinar um modelo de IA.Analisar todos os ângulos de um problema, considerar a fonte correta de…",https://tinyurl.com/y6bhoo5d
Cientista de dados PL - BH,"Belo Horizonte, MG",Stefanini,"Experiência na análise de grandes conjuntos de dados multidimensionais com uso de consulta de dados (SQL), ferramentas de BI (PowerBI), linguagens de…",https://tinyurl.com/ydu74yvu
Cientista de Dados,"São Paulo, SP",Braskem,"We are looking for a Data scientist to join our rapidly growing team.You will join Braskem’s new Digital Center, which is an innovation hub set up to develop…",https://tinyurl.com/y4rjkkcu
Cientista de Dados,"Rio de Janeiro, RJ",FGV - Fundação Getulio Vargas,Conhecimento de banco de dados não estruturados e estruturados (SQL/NoSQL);Conhecimento de técnicas de modelagens estatísticas e machine learning;,https://tinyurl.com/y4mesdg3
CIENTISTA DE DADOS SR,"Rio de Janeiro, RJ",Fox Human Capital,":: Liderar projetos que envolvam o uso de inteligência artificial e Machine Learning, expandindo a cultura de decisões baseadas em dados na empresa;",https://tinyurl.com/y54t5y6z
Estágio em Data Analytics / Cientista de dados 01 VAGA,"São Paulo, SP",None,2 - Estágio em Data Analytics / Cientista de dados.PARA VER ESTA E OUTRAS VAGAS DE EMPREGO ACESSE O SITE OFICIAL DESTA VAGA WWW.TALENTOSBRILHANTES.NET.,https://tinyurl.com/y4wocr9o
