Cargo,Local,Empresa,Descrição,Link
Engenheiro de Sistemas Sênior (Dados e Arquitetura),"Campinas, SP",#vempraGateware,Boa compreensão de bancos de dados RDBMS e bancos de dados No-SQL.Boa experiência em jobs de scripts de automação de build e automação de implantação.,https://tinyurl.com/y85ygqcg
Engenheiro (a) de Dados Sênior,"Palhoça, SC",CALCARD,"Capacidade de desenvolver cargas e realizar integrações de novas fontes de dados.Postura de protagonista e de fazer as coisas acontecerem – sim, precisamos do…",https://tinyurl.com/ycwmgbmy
Engenheiro de Dados - SP - Remoto,Remoto,Neobpo,Levantamento de necessidades e definições de formato de integração de dados;Experiência em soluções de dados;Experiencia em modelagem de dados;,https://tinyurl.com/y9gq3bg3
Engenheiro de Dados Trainee,"São Paulo, SP",Leega Consultoria,Bons conhecimentos de banco de dados.Bons conhecimentos de lógica de programação.Se você busca uma empresa dinâmica e parceira e que investe em seus…,https://tinyurl.com/ycb7om26
Engenheiro de Dados KAKFA,"Campinas, SP",Kumulus Cloud e Data,"Quer fazer parte de uma das melhores empresas de serviços focados em Cloud, Data & AI da América Latina ?Kafka development, including Kafka connect and Kafka…",https://tinyurl.com/yd2rqkm6
Engenheiro de Dados AWS,"Campinas, SP",Kumulus Cloud e Data,"Participação em projeto de dados;Noção de Arquitetura de Dados.Metodologias de Gestão de projeto Ágil.Conceitos de Datalake (Raw, Storage, History, Processed…",https://tinyurl.com/ycswfxfe
Engenheiro de Dados SR,"São Paulo, SP",GuiaBolso,Conhecimento de bancos de dados;Construção de pipeline de dados para geração de tabelas;O Engenheiro de dados tem como missão capturar e transformar grande…,https://tinyurl.com/y7rldu8a
Engenheiro De Dados - DV,"Jaguariúna, SP",Divulga Vagas,"Construir, avaliar e executar scripts de atualização de dados de forma performática.Experiência com ferramentas de ETL e integração de dados;",https://tinyurl.com/y98kuy79
Engenheiro de Dados AWS Sênior,"São Paulo, SP",Keyrus Brazil,Apoiar a definição de processos de integração de dados especificando os resultados finais da modelagem.Desenvolver processos de integração de dados utilizando…,https://tinyurl.com/yd7coh65
Engenheiro De Dados - BV,"São Paulo, SP",Buscar Vagas,Experiência com criação de pipelines de ingestão de dados usando Google Cloud.Experiência com criação de pipelines de ingestão de dados usando Google Cloud.,https://tinyurl.com/y7huw8ly
Especialista em TI ( Engenheiro de Dados - ETL) - CSC TI - I...,"Rio de Janeiro, RJ",Rede D'Or São Luiz,ESPERE DE NÓS: Oportunidade de influenciar a adoção de métodos práticos de engenharia de dados em companhia de grande porte Trabalhar com as mais novas…,https://tinyurl.com/yczvcwdu
Engenheiro De Dados (Azure) - DV,"Campinas, SP",Divulga Vagas, Irá atuar no desenvolvimento de Pipelines de ingestão e tratamento dos dados em ambientes big data e também transacionais.,https://tinyurl.com/yb6uvlhx
ENGENHEIRO DE DADOS,"Poá, SP",REDE GERANDO FALCÕES,Combinar fontes de dados para posterior consumo de informações cruzadas;Criar a arquitetura de dados;Conhecimento em ferramentas de report e visualização de…,https://tinyurl.com/y83zykv3
Engenheiro de Dados Jr.,"São Paulo, SP",Mercado Bitcoin,Trabalhar os dados de acordo com as regras de negócio.Queremos você no nosso time de Engenharia de Dados que é responsável por gerar informações para toda…,https://tinyurl.com/ya4dwbmo
Engenheiro de Dados Pleno (Frete),"São Paulo, SP",B2W Digital,"Conhecimento sobre pipeline de dados, integração de bancos, crawlers, monitoria de de jobs.Capacidade de contribuir com otimizações de arquitetura de ETL e BI.",https://tinyurl.com/y7qmm26v
Estagiário de Engenharia de Dados,"Rio de Janeiro, RJ",MindTek,Auxiliar em projetos de análise de dados para diversos clientes.Estamos em busca de um Estagiário de Engenharia de Dados.Banco de dados: Relacional e NoSQL;,https://tinyurl.com/y99496no
Engenheiro de Dados Sênior Cód.: 265218,"São Paulo, SP",Mirante Tecnologia,"Obrigatórios: Para esta posição é necessário possuir sólida vivência técnica Oracle 12g (modelagem e manipulação de dados), Desenho e Implantação de soluções BI…",https://tinyurl.com/yd5a7j7n
Especialista em TI (Engenheiro de Dados) - Inovação Corporat...,"Rio de Janeiro, RJ",Rede D'Or São Luiz,"Formação Acadêmica: Superior completo em Engenharia de Software, Ciência da computação e (ou) àreas correlatas - Certificação: Desejável - Azure - Experiência:…",https://tinyurl.com/y9hn777e
Engenheiro(a) de Dados,"São Paulo, SP",Nestlé,Ser engenheiro(a) de dados na Nestle significa sair da zona de conforto para transformar diversas informações em dados que vão mexer no ponteiro do nosso…,https://tinyurl.com/yczdykxk
Engenheiro de Dados - remoto -SP,"Barueri, SP",Holden Consultoria & Rh Ltda,Experiência em banco de dados SQL SERVER.Experiência em Desenvolvimento e modelagem de Data Warehouse.Experiência em arquitetura e processos de cargas para…,https://tinyurl.com/y746jwhv
Engenheiro(a) de Dados Hadoop (remoto),Brasil,GeekHunter,Projeto inicial de 2 meses com grande possibilidade de prorrogação.Convênio com desconto em instituições de ensino e cursos de Idiomas;O que você irá fazer?,https://tinyurl.com/ydbzxgk6
Coordenador(a) de Engenharia de Dados,"São Caetano do Sul, SP",Via Varejo S.A.,"Liderar a equipe de engenharia de dados responsável por ingerir, preparar e disponibilizar dados para as áreas de negócio.Além disso, vamos te desafiar em:",https://tinyurl.com/ycq3mucb
Engenheiro de dados Pleno,"São Paulo, SP",Synapcom,Experiência com bancos de dados SQL.Experiência com modelagem de dados;Estamos buscando Engenheiro (a) de dados para compor nosso time de Analytics/ Dados.,https://tinyurl.com/y83ppl8q
Engenheiro(a) de Dados sênior AWS,"São Paulo, SP",GeekHunter,"Conhecimento com modelos de integração de dados, ambientes complexos de integração de dados (em ambientes de BI e Big Data).O que você irá fazer?",https://tinyurl.com/yaom6f52
Engenheiro(a) de Dados sênior Python,"São Paulo, SP",GeekHunter,Administração de ambientes de dados (implantação de pacotes de solução).Interação com a equipe funcional e engenheiros de dados para entender os requisitos a…,https://tinyurl.com/y8nq8ode
Engenheiro de Dados.,"São Paulo, SP",Hprojekt,"Compreensão de estruturas de dados, modelagem de dados e arquitetura de software;Selecionar conjuntos de dados apropriados e métodos de representação de dados;",https://tinyurl.com/y7cotdp6
Engenheiro(a) de Dados Python,"São Paulo, SP",GeekHunter,"Conhecimento em processos de engenharia de dados (Big Data ou BI Enviroment).Apoiar a estratégia de arquitetura de dados definida, com foco central na ingestão…",https://tinyurl.com/ycoj9p7k
Engenheiro(a) de Dados [Java/Scala],Rio Grande do Sul,Datum,"Um mundo cheio de desafios;Framework de processamento distribuído Spark;Sua stack é ETL, Java e Scala?A @Datum quer adicionar você!",https://tinyurl.com/ydxu6dmw
Engenheiro de dados,"Campinas, SP",JR Assessoria em RH,Buscamos Engenheiro de Dados para atuar no time na região de Campinas!Diretrizes de distanciamento social aplicadas.Transferência de bancos DB/DW.,https://tinyurl.com/yaa537hx
Analista e/ou Engenheiro de Dados - PJBank - Campinas,"Campinas, SP",Superlógica,Experiência com o tratamento de manipulação de múltiplas fontes de dados e grande volume de dados;Escalar e manter a infraestrutura de dados;,https://tinyurl.com/y9vcvxan
[RJ] Engenheiro de Dados / Analista de Power BI,"Rio de Janeiro, RJ",RADIX Engenharia e Software,Implementação de transformações de dados para elaboração de indicadores.Conhecimento das soluções de manipulação de dados da Azure.Que tal fazer parte disso?,https://tinyurl.com/y8lh7uq7
Engenheiro/a de Dados Senior,"São Paulo, SP",Ernst & Young,Auxilia no Desenvolvimento de novos estudos baseado em diferentes tipos de dados.Com os fornecedores de dados identificados para cada necessidade.,https://tinyurl.com/y9wcnuy9
Engenheiro de Dados Sênior,"Alphaville, SP",Wayon,"Modelagem de Dados (Modelagem para BI/DataMart - Start Schema/Snowflake, Modelagem de dados para NoSQL).Engenheiro de Dados / Data Engineer.",https://tinyurl.com/yabxculw
ENGENHEIRO DE DADOS (M/F),"Joinville, SC",RHBRASIL,"Desenvolvimento de ferramentas de melhorias e processos com alto volume de dados, interface com todos as áreas da empresa, negócios, MKT, RH.",https://tinyurl.com/ybb7t3up
Engenheiro de Dados Sênior,"São Paulo, SP",Mttechne,"Atuação com banco de dados..Experiência de implementação de Banco de Dados SQL e NoSQL (Cassandra, MongoDB);.Conhecimento em Ferramentas de ETL;",https://tinyurl.com/y8mf65j9
Engenheiro de Dados,"Campinas, SP",#vempraGateware,Responsável por encontrar tendências nos conjuntos de dados e desenvolver algoritmos para transformar os dados brutos em informações úteis para tomada de…,https://tinyurl.com/y7ea2gbo
Engenheiro de Dados Junior,Brasil,Red Pill RH,Experiência com bancos de dados relacionais;Conhecimento em modelagem de dados relacional;Manutenção dos sistemas e soluções de armazenamento e processamento…,https://tinyurl.com/y8hs3h92
Engenheiro(a) de Dados,"São Paulo, SP",Sami,"Organizar nossas massas de dados, prepará-las para o uso dos times de Analises, nosso modelador de dados.Estruturar a área de Engenharia de Dados.",https://tinyurl.com/y7qa6afa
Engenheiro de Dados Pleno,Remoto,Eleflow Big Data,"Conhecimentos e experiência nas melhores práticas em automação da carga de dados bem como de governança de dados.Azure Data Lake, Data Factory, Databricks.",https://tinyurl.com/y8jcj9op
Engenheiro de Dados PowerCenter + BDM JR,Brasil,Red Pill RH,Banco de dados SQL Server.Nosso cliente possui a missão de auxiliar as empresas a extrair todo o potencial de Dados e Digital objetivando aumentar seu…,https://tinyurl.com/y72rl7rp
Engenheiro de dados - Remoto,Remoto,Sentimonitor,"A Sentimonitor está com uma oportunidade para ""Engenheiro de dados"" júnior/pleno: você trabalhará na especificação, projeto e integração de novas fontes de…",https://tinyurl.com/yb3ujfas
Engenheiro de Dados - Quios Invest,"São Paulo, SP",Semantix,Quer impactar bilhões de vidas com dados?Curso de inglês e espanhol (in company) - Após 03 meses de empresa.O next procura engenheiro de dados em perfil Pleno…,https://tinyurl.com/y83yb7pt
Engenheiro de Dados,"Jaguariúna, SP",DOMVS TI,Extração de dados dos sistemas origem.Carga de dados na nuvem;Especificação técnica dos projetos de dados;Melhoria contínua da plataforma de dados.,https://tinyurl.com/ya9uasja
[REMOTO] Engenheiro de Dados Sr.,"São Paulo, SP",RADIX Engenharia e Software,"Manipular, processar e extrair valor ou soluções de negócio de grandes conjuntos de dados desconectados;Manipulação de dados em SQL;Que tal fazer parte disso?",https://tinyurl.com/yc8powc3
Engenheiro de Dados,"Jacareí, SP",Yoctoo,"Os membros da equipe devem ser engenheiros ou engenheiros de dados e/ou possuir experiência em aplicações de pipeline/streaming de dados (MLflow, Airflow, Kafka…",https://tinyurl.com/ybvucdkv
Engenheiro de Dados Senior Power Center,Brasil,Red Pill RH,Solução de problemas (busca de soluções).Nosso cliente possui a missão de auxiliar as empresas a extrair todo o potencial de Dados e Digital objetivando…,https://tinyurl.com/y7tdowgr
Engenheiro(a) de Dados PL (Crawler),"Curitiba, PR",MadeiraMadeira,"Sua principal missão será atuar na captação de dados de sites terceiros e armazenamento no Data Lake House da empresa, contribuindo ativamente com os processos…",https://tinyurl.com/y7gxltlm
Data Engineer (Data Engineering) (Engenheiro de dados) Júnio...,"Campinas, SP",Ewave do Brasil,"Como Engenheiro de Dados, você será responsável por projetar, desenvolver e implantar desenvolvimento de ETLs para processar petabytes de dados por meio de…",https://tinyurl.com/y98aljtk
Engenheiro(a) de Dados (remoto) Airflow,"Palhoça, SC",GeekHunter,Responsável pela administração e gerenciamento das cargas de dados ETLs da Calcard.Atuar nos projetos de Criação dos DataMarts de acordo com os objetivos do…,https://tinyurl.com/ya8ktabs
Engenheiro de Dados,"Porto Alegre, RS",Lojas Renner,"O engenheiro de dados será responsável por prover a estrutura de dados e os dados em si que a Squad precisa para cada caso de uso ou necessidade, assim como…",https://tinyurl.com/y8yt4awx
Engenheiro(a) de Dados,"São Paulo, SP",Algar Tech,Engenheiros de dados são membros vitais de qualquer equipe corporativa de análise de dados.Responsáveis por encontrar tendências nos conjuntos de dados e…,https://tinyurl.com/y7petkab
Engenheiro de Dados/Analytics,"Florianópolis, SC",Carreiras na BoletoFlex,"Experiência em áreas de gerenciamento de dados, incluindo modelagem de dados, qualidade de dados e outras áreas diretamente relevantes para a engenharia de…",https://tinyurl.com/ybkbdejs
Engenheiro de Dados Sênior,"Belo Horizonte, MG",Core Synesis Ltda,"A carteira de clientes se caracteriza por um alto grau de Fidelização e um índice de satisfação em torno de 90%, conforme pesquisas realizadas.",https://tinyurl.com/yd6lb7qx
Engenheiro de Dados Sênior ( remoto),"São Paulo, SP",Holden Consultoria & Rh Ltda,Experiência em banco de dados SQL SERVER;Experiência em Desenvolvimento e modelagem de Data Warehouse;Experiência em arquitetura e processos de cargas para…,https://tinyurl.com/y7c8svge
Engenheiro de Dados Azure,Brasil,Red Pill RH,"Engenheiro de Dados Senior com no mínimo 5 anos de experiência em processos de ingestão de dados, para atuar em processo de ingestão de dados baseado em PySpark…",https://tinyurl.com/y8awou2a
Engenheiro de Dados PL,"Curitiba, PR",Grupo Boticário,"Desenvolver estratégias de aquisição de dados (históricos e online), recuperação de informação, implementação de pipelines de processamentos de dados e…",https://tinyurl.com/y8fyfytf
Engenheiro/a de Dados Pleno,"São Paulo, SP",Ernst & Young,Coordenar o desenvolvimento de novos estudos baseado em diferentes tipos de dados.Coordenar a criação e manutenção de pipeline de dados utilizando os sistemas…,https://tinyurl.com/ydx74flo
Engenheiro de Dados / Cientista de Dados - Sênior - DataSUS,Brasil,Red Pill RH,Experiência com modelagem de dados.Suporte em integração de dados DataSUS com outras fontes de mercado e internas.Experiência de trabalho com base DataSUS.,https://tinyurl.com/y743cs5p
Engenheiro de dados - Remoto,Brasil,Deal Technologies," Qualquer banco de dados Relacional.Modelagem de Datasets e Dataflows em PowerBI, utilizando as novas fontes de dados.Experiência de 2 anos na função.",https://tinyurl.com/y7uy9ao3
Engenheiro de Dados Senior (Python + GCP),Brasil,Red Pill RH,"Espera-se que este profissional tenha conhecimento em técnicas de captura, tratamento e estruturação de dados em arquitetura de processamento de dados com…",https://tinyurl.com/y7dwfbqc
Engenheiro/a de Dados Senior Splunk,"São Paulo, SP",EY,"Se posicionar como uma liderança técnica para demandas de engenharia de dados.Construção de painéis, ingestão de dados, otimização de consultas, melhorias em…",https://tinyurl.com/y9yco2co
Engenheiro de Dados Sênior,"São Paulo, SP",Cognizant,Desenho de soluções de engenharia de dados oIdentificação e correção de erros de funcionalidades já existentes.Employee Status : Full Time Employee.,https://tinyurl.com/y7fte883
Engenharia de Dados Pleno **,Remoto,A3Data,"Integração das plataformas de visualização de dados com Cloud.Experiência com ferramentas de orquestração de pipeline de dados (Airflow, StepFunctions ou…",https://tinyurl.com/yat8jt2j
Engenharia de Dados - GCP | Pleno/Sênior,Brasil,Compasso UOL,Construir scripts de transformação de dados transacionais e analíticos;Trabalhar com processamento de volumes massivos de dados em streaming e batch.,https://tinyurl.com/yaytpbzm
Engenheiro de Dados Informatica Cloud Sr,Brasil,Red Pill RH,Engenheiro de dados Sr. responsável pelo desenvolvimento de pipeline de dados utilizando a ferramenta Informatica Cloud com experiência em trabalhos com grandes…,https://tinyurl.com/yd2tz9kp
Consultor(a) | Engenheiro(a) de Dados,"São Paulo, SP",Vivo Digital,#Mobility • Ter flexibilidade de horário; • Aproveitar um dia de folga (Day off) para comemorar seu aniversário; • Participar de um dos maiores programas de…,https://tinyurl.com/ybbzg8g4
Engenheiro de Dados Big Data Python AWS,Brasil,Red Pill RH,"Engenheiro de dados para apoiar cliente com engenharia reversa e validação de dados em ambiente Big Data.Atuará tanto no desenvolvimento dos fluxo de carga,…",https://tinyurl.com/y7v4bcqp
Engenheiro de Dados Azure Senior,Brasil,Red Pill RH,Engenheiro de Dados Senior responsável pelo fluxo de ingestão de dados:Construir pipelines de extração de dados de diversas fontes e armazenar em um Azure Data…,https://tinyurl.com/yal9ubfk
Engenheiro de Dados - Senior,"Campinas, SP",#vempraGateware,Responsável por encontrar tendências nos conjuntos de dados e desenvolver algoritmos para transformar os dados brutos em informações úteis para tomada de…,https://tinyurl.com/yd5qyhly
Engenheiro(a) de Dados,"Belo Horizonte, MG",Hotmart,Experiência em pipelines de fluxo de dados utilizando ferramentas de ETL;Nossa área de Data Science está em busca de um(a) Engenheiro(a) de Dados para nos…,https://tinyurl.com/y9mwga2p
Engenheiro de Dados,"São Paulo, SP",Dedalus Prime,Ajudar na formação de uma equipe de dados focada na construção e sustentação de projetos de dados;Capacidade de analisar e solucionar problemas de dados…,https://tinyurl.com/y6wo2zq8
Analista De Sistemas - Engenharia De Dados,"Jaraguá do Sul, SC",WEG Germany GmbH,"Participar da análise e desenvolvimento de soluções com foco em análise de dados, sendo responsável pela coordenação de projetos de software, considerando o…",https://tinyurl.com/y7m3zjb4
Consultor(a) Engenharia de Dados,"Recife, PE",Avanade,Com a manipulação de dados e criação de processos de ETL.Domínio de técnicas de processos de ETL/Modelagem dimensional;Ter conhecimento de metodologia ágil;,https://tinyurl.com/yc2lfdto
Consultor(a) de Engenharia de Dados Sr,"São Paulo, SP",Avanade,Com a manipulação de dados e criação de processos de ETL.Domínio de técnicas de processos de ETL/Modelagem dimensional;Ter conhecimento de metodologia ágil;,https://tinyurl.com/y6uf3mx8
Engenheiro de Dados - Sênior | Java e Hadoop,"São Paulo, SP",Semantix,"Quer impactar bilhões de vidas com dados?Formato de dado: Parquet, Pyspark.Atuar no processamento de dados por meio do Spark (Python);SQL em Hive e Impala.",https://tinyurl.com/ycxkvqut
Engenheiro de Operações e Segurança de Dados,"São Paulo, SP",Luandre Soluções em RH,"Esse profissional será responsável por Implementar e controlar diversos ambientes de SGBD´s, Controlar a obtenção de dados de fontes externas, analisando…",https://tinyurl.com/y9fu28rp
Engenharia de Dados - Junior e Pleno,"Belo Horizonte, MG",A3Data,"Conhecimento de modelagem de dados.Extração de dados de diversas fontes como API, SFTP, diretório mapeado e com banco de dados como SQL.",https://tinyurl.com/y759wkpz
Engenheiro(a) de Dados,"São Paulo, SP",Dasa,"Conhecimento em processos de engenharia de dados (Big Data ou BI Enviroment);Apoiar a estratégia de arquitetura de dados definida, com foco central na ingestão…",https://tinyurl.com/ycd27g3v
ENGENHEIRO DE DADOS / DATA ENGINEER,"São Paulo, SP",Ali,"Experiência em arquitetura de dados;Processamento de dados em real time;Este / Esta profissional será responsável por atribuições que incluem a construção,…",https://tinyurl.com/ycjuj3an
Engenheiro/a de Dados Pleno Splunk,"São Paulo, SP",EY,"Se posicionar como uma liderança técnica para demandas de engenharia de dados.Construção de painéis, ingestão de dados, otimização de consultas, melhorias em…",https://tinyurl.com/y7k7zg3d
Engenheiro(a) de Dados Pleno,"Belo Horizonte, MG",BHS,"Conceitos de pipeline de engenharia de dados.Ambiente de engenharia de dados com conhecimentos sólidos de modelagem de dados, consultas usando SQL, scripts e…",https://tinyurl.com/y7na5buu
Data Engineer (Data Engineering) (Engenheiro de dados) Pleno,"Campinas, SP",Ewave do Brasil,"Como Engenheiro de Dados, você será responsável por projetar, desenvolver e implantar desenvolvimento de ETLs para processar petabytes de dados por meio de…",https://tinyurl.com/yazkghgj
Analista Engenharia de Dados Sr.,"São Paulo, SP",Avanade,Com a manipulação de dados e criação de processos de ETL.Modelar os dados em um ambiente de BigData / DataWareHouse.Amar a área de tecnologia.,https://tinyurl.com/y8cfzvez
Engenheiro(a) de dados (CSC Jaguariúna),"Jaguariúna, SP",Ambev,Paixão por engenharia de alta qualidade.Construção/consolidação e automação de dados.Plano de saúde + odontológico.Venda de produtos para funcionários.,https://tinyurl.com/y77cjvau
Engenheiro de Dados - Spark & Cloudera,"São Paulo, SP",Semantix,Ira realizar migração e atividades de engenharia de dados.Quer impactar bilhões de vidas com dados?Habilidades analíticas e lógicas de resolução de problemas;,https://tinyurl.com/y4vj3ps6
Engenheiro de Dados Microsoft,"Campinas, SP",Kumulus Cloud e Data,"Análise e levantamento de requisitos, definição e modelagem de dados, extração, transformação e apresentação de dados.Dominio de conceitos de Camada Semantica;",https://tinyurl.com/y9oz3wuw
Engenheiro de Dados Pleno,"São Paulo, SP",Elo7,"Somos um time de engenheiros responsável por construir a infraestrutura de dados voltada a eventos, gerando dados de suporte à tomada de decisão para a empresa.",https://tinyurl.com/y97k2xom
ENGENHEIRO DE DADOS,"São Paulo, SP",AlfaCon,"Conhecimento de projetos técnicos e funcionais para as áreas de bancos de dados, data lake, relatórios e mineração de dados;Você quer trabalhar com Big Data?",https://tinyurl.com/y29oe9wa
Engenheiro de Dados,"São Paulo, SP",ORANGEFOX TI,Experiência prévia em desenvolvimento de ETL/Jobs de integração de dados e/ou Data Marts.Capacidade de abstrair conceitos de negócio em desenvolvimento de…,https://tinyurl.com/yxw7gvb3
Engenheiro de Dados,"Porto Alegre, RS",Zallpy Digital,Responsável pela administração e gerenciamento das cargas de dados ETLs da companhia;Capacidade de Desenvolvimento de Dashboards com as principais ferramentas…,https://tinyurl.com/ycpsh2ze
Engenheiro de Dados Spark Cloudera Sênior,Brasil,Red Pill RH,O consultor irá trabalhar com tarefas de desenvolvimento e manutenção de rotinas utilizando PySpark e Pandas para ETL de entidades no Datalake.,https://tinyurl.com/y95l9zsq
Engenheiro de Dados AWS,"São Paulo, SP",Leega Consultoria,"Modelagem de Dados Relacional e Dimensional.Se você busca uma empresa dinâmica e parceira e que investe em seus colaboradores através de capacitação constante,…",https://tinyurl.com/y35te539
Engenheiro de dados,"São Paulo, SP",Holos Media,"A Holos Media trabalha no planejamento e gestão de campanhas de mídia online, análise de métricas e dados, estratégias de posicionamento orgânico e inteligência…",https://tinyurl.com/y6qujc6y
Engenheiro(a) de Dados ETL,"São Paulo, SP",GeekHunter,Implementar soluções de extração de dados;Monitorar e assegurar a execução dos pipelines de extração de dados;Processamento de dados em Batch e Streaming;,https://tinyurl.com/y9bthhgh
Engenheiro de Dados Sr.,"São Paulo, SP",3CON,MBA em Projetos de Sistemas.Estamos em busca de um(a) Engenheiro de Dados Sr. para atuar numa das maiores varejistas do país!Faça parte desse time❗️.,https://tinyurl.com/ycwnsmp6
Engenheiro de Dados Sênior,"São Paulo, SP",Porto Seguro,"Experiência com ferramentas de ETL e integração de dados;Conhecimentos em modelagem e qualidade de dados;Trata-se de uma área estratégica da TI, que habilita…",https://tinyurl.com/ya28q8r3
Engenheiro De Dados Sênior - BV,"Rio de Janeiro, RJ",Buscar Vagas,"Desenvolvimento de pipelines de dados, armazenamento e catálogo de dados;Experiência em levantamento de dados e arquitetura de sistemas;",https://tinyurl.com/y7fvhvrk
Engenheiros de Dados Sênior,"São Paulo, SP",Softtek,Análise e levantamento de requisitos junto às áreas de negócio;Bancos de dados relacionais e linguagem SQL (Oracle / SQL Server);Junte-se a Softtek Brasil!,https://tinyurl.com/y62zu4dr
Engenheiro de Dados Júnior,"Porto Alegre, RS",WK JobHub,"Experiência em normalização de dados.Agregar valor aos contratos de uma empresa de prestação de serviços de TI através da consolidação e modelagem de dados,…",https://tinyurl.com/yxnxblnm
Engenheiro (a) de Dados Sênior,"Curitiba, PR",Olist,"Construir junto com o time de engenharia de dados os pipelines de dados em evoluções e projetos de data e analytics, em ambientes de Data Warehouse e Data Lakes…",https://tinyurl.com/y32td6zt
Engenheiro de Dados,"Curitiba, PR",Neodent,"Atuação em projetos de Big Data, preferencialmente na construção de camadas de ingestão de dados e/ou estruturação de dados.A gente faz o mundo sorrir.",https://tinyurl.com/y7g8w6mp
Engenheiro de Dados,"São José dos Campos, SP",TerraMagna,Experiência em engenharia de dados e/ou desenvolvimento de software.Descobrir oportunidades para a aquisição de novos dados.Experiência em pipelines e ETL.,https://tinyurl.com/y2b9cw2w
Engenheiro de Dados,"São Paulo, SP",DogHero,Em parceria com os times de Produto e Engenharia implementar o sistema de rastreamento de dados.Criar pipelines de dados e ETL para a implementação de Data…,https://tinyurl.com/y3xqb7yk
