Cargo,Local,Empresa,Descrição,Link
Pessoa Engenheira de Machine Learning,"Maceió, AL",Weni,"Trabalhar fornecendo orientações, ferramentas e componentes na integração de modelos de aprendizado de máquina.Desenvolver modelos de Machine Learning.",https://tinyurl.com/y8gja9wm
Engenheiro de Machine Learning,"São Paulo, SP",Conquest One,Experiência anterior na plataforma de machine learning Amazon Sage Maker.Conhecimento em Machine Learning e Ciclo de Vida de Modelagem.,https://tinyurl.com/y8f3nqgp
Cientista de Dados e Engenheiro(a) de Machine Learning,"Florianópolis, SC",CERTI,Cientista de dados com experiência em treinamento de modelos de Inteligência Artificial e implementação de serviços de predição em nuvem;,https://tinyurl.com/yazggkgk
Engenheiro/a de Machine Learning,"São Paulo, SP",EY,Conhecimento em engenharia de dados e compreensão de técnicas de Machine Learning.Implementar fluxos de trabalho para habilitar pipeline de industrialização de…,https://tinyurl.com/y2pkfnxf
Pessoa Engenheira de Machine Learning,"Porto Alegre, RS",Lojas Renner,"Essa pessoa atuará em conjunto com os times de Ciência de Dados, Engenheiros de Software, Engenheiro de Dados e nossas equipes de negócio no desenvolvimento de…",https://tinyurl.com/y4lm77w7
