Cargo,Local,Empresa,Descrição,Link
Analista de Dados Sr - RBrasil,"São Paulo, SP",Atento Corporate,"Atuar em processos de modelagem de dados com foco em BI;Desejável com Infra em Banco de dados, metodologias ágeis, conhecimento em modelos de negócios de…",https://tinyurl.com/y39zaxo4
Analista de Dados - Power Center / MDM/IICS - remoto,"São Paulo, SP",HOLDEN Recruiting Talents,O profissional fará parte do time de extração e integração de dados de grande empresa no mercado.Empresa de Consultoria de Grande porte.BI( mais de 3 anos);,https://tinyurl.com/yyz3kxl5
Analista de Dados Power BI (remoto),"Belo Horizonte, MG",GeekHunter,"Coleta de dados, desenvolvimento de consultas e elaboração de relatórios e dashboards;Vivência na aplicação de modelos estatísticos em grandes volumes de dados…",https://tinyurl.com/y5xpujps
Analista de Processos e Dados,"São Paulo, SP",GRUPO GR,Construção de base de dados e estrutura de dashboards de indicadores.Metodologia de mapeamento de processos e desenho de fluxogramas;,https://tinyurl.com/y66c55zg
Analista de Dados Pleno (Specialist II),"São Paulo, SP",TransUnion,"Cuidar do processo de ingestão de dados.Experiência em SQL, ou outras linguagens de banco de dados similares.Dar suporte na integração de novas fontes.",https://tinyurl.com/y6t2v8z6
Analista de Operações (Dados),"Curitiba, PR",Olist,"Você será responsável pelo desenvolvimento, manutenção e melhoria de dashboards, análise de dados, elaboração e automações de scripts de baixa a média…",https://tinyurl.com/y6trn86y
Analista de Dados Pleno ou Sênior,Remoto,Hagloo,"Extração de integração dos dados.Data Warehouse - armazenamento de dados digitais.Modelagem de dados(multidimensional, tabular).",https://tinyurl.com/y2rz5835
Analista de Logística (BANCO DE DADOS),"São Paulo, SP",Divulgações,Acompanhamento de adequações de produtos importados;A segurança e qualidade de nossos produtos é a base para a sólida relação de confiança que construímos com…,https://tinyurl.com/y3sdcyjo
Analista de Assuntos Regulatórios (BANCO DE DADOS),"Jaboatão dos Guararapes, PE",Divulgações,"Analise e revisão de materiais promocionais, obra de artes de produtos (instruções de uso) e embalagens).A segurança e qualidade de nossos produtos é a base…",https://tinyurl.com/y3tqbaba
Analista de Dados | Foco em cadeia de Fornecimento,"Porto Alegre, RS",Lojas Renner,Gestão de dados e identificação de oportunidades de obtenção de informações.Desenvolvimento do projeto de ciência de dados com foco no risco dos fornecedores…,https://tinyurl.com/y4ms5tsg
Engenharia de Dados - Analista Pl,"São Paulo, SP",GPA,Desenvolvimento de integrações de dados no ecossistema Hadoop;Organização e garantia da comunicação entre os dados do lake as demais aplicações da diretoria …,https://tinyurl.com/yyzor9ot
Analista de Dados,"Campinas, SP",GeekHunter,"Criar a infraestrutura necessária para a extração, transformação e carregamento de dados de uma ampla variedade de fontes.O que você irá fazer?",https://tinyurl.com/y3xpvfbf
Analista de Dados - especialista em Data Visualization (BIs),"Florianópolis, SC",DOJO Technology,"Você será o especialista com em criar interfaces de inteligência de dados, para nossos clientes, que possibilite soluções técnicas para a resolução de problemas…",https://tinyurl.com/yymkqrjh
Analista de Banco de Dados,"Sarzedo, MG",Grupo Selpe,"Experiência com atuação em análise de banco de dados, Business Intelligence e SQL Server 2003/2008;Levantar dados, definir processos e recursos necessários…",https://tinyurl.com/y652nkby
Analista de Dados Google Analytics Pleno,"São Paulo, SP",GeekHunter,Análise e inteligência de dados.Acompanhamento de KPIs de vendas e detecção de problemas e oportunidades para direcionamento de decisões estratégicas.,https://tinyurl.com/yxefy96n
Analista de dados,"Joinville, SC",Becomex,Construção de ferramentas para apoio ao processo de gestão dos dados.Levantamento de análise de requisitos.Arquitetura e manutenção de soluções de BI.,https://tinyurl.com/y3mxlwpt
Analista II de Banco de Dados,"Salvador, BA",TOTVS,Efetuar mapeamento de estrutura de bancos de dados de aplicações;Fundamentos de banco de dados relacional - intermediário;Vem fazer parte de tudo isso!,https://tinyurl.com/y3fq37we
Analista de Suporte em Administração de Banco de Dados (SCA),"Fortaleza, CE",Lanlink Informática,Realizar as atividades listadas no nível SCM de administração de dados;Executar análise e fornecer suporte a criação e manutenção de base de dados conforme…,https://tinyurl.com/y5khbkde
Cientista de Dados SR/ Analista de Dados SR,"São Paulo, SP",General Motors,"Análise e modelagem de dados.Desenvolvimento de ferramentas de Business Intelligence utilizando diversas fontes de dados para montagem de modelos preditivos,…",https://tinyurl.com/yarfffmc
Analista de Dados,"Blumenau, SC",Senior Sistemas,"Desenvolver views e cubos de dados.Propor a resolução de problemas de negócios, usando técnicas orientadas por dados.Conhecimento em ferramentas de ETL.",https://tinyurl.com/yaa4tkjo
Analista de Dados (Pereiro - CE),"Pereiro, CE",Brisanet,Promover a cultura de inteligência de dados com a divulgação de estudos nos clientes internos.Análise e manipulação de dados em planilhas;,https://tinyurl.com/y3q9n2ra
Analista de Engenharia de Dados Sr,"Barueri, SP",C&A,Desenvolver fluxos de tratamento de dados utilizando Python;Experiência em tratamento de dados utilizando Python;A C&A é muito eu.,https://tinyurl.com/y2h99neq
