Cargo,Local,Empresa,Descrição,Link
Engenheiro de Dados,Estado de São Paulo,GFT Technologies,Levantamento de necessidades e definições de formato de integração de dados;Experiência em soluções de dados;Experiencia em modelagem de dados;,https://tinyurl.com/y2686yzr
Engenheiro(a) de Dados (remoto) SQL,Brasil,GeekHunter,O que você irá fazer?At least 3 years of extensive experience.Report to Co-Founder/Managing Partner.Data-driven analytical mindset with 'can-do' attitude.,https://tinyurl.com/y2bcdjfs
Engenheiro de Dados - remoto -SP,"Barueri, SP",HOLDEN Recruiting Talents,Experiência em banco de dados SQL SERVER;Experiência em Desenvolvimento e modelagem de Data Warehouse;Experiência em arquitetura e processos de cargas para…,https://tinyurl.com/y5vpbhet
Engenheiro de Dados / Cientista de Dados Sênior,"São Paulo, SP",TAKING,"Nível de título de mestrado em ciência de dados, pesquisa operacional ou planejamento de transportes;Conhecimento avançado de desenvolvimento com banco de…",https://tinyurl.com/y6he6zof
Engenheiro de Dados PL/SR,"Curitiba, PR",TAKING,"Aplicação de regras de negócios e disponibilização nas estruturas de dados.REQUISITOS: -Prática no desenvolvimento de pipelines de dados, fazendo uso de Python…",https://tinyurl.com/y6p8jahf
Engenheiro de Dados Senior,"São Paulo, SP",Cognizant,"Bachelors in science , engineering or equivalent.Understand the functional/ nonfunctional requirements.Prepare the list of requirements and seek review inputs…",https://tinyurl.com/y4lqpgau
Engenheiro de Dados AWS Sênior (Portal EC),"Barueri, SP",Leega Consultoria,"Modelagem de Dados Relacional e Dimensional.Se você busca uma empresa dinâmica e parceira e que investe em seus colaboradores através de capacitação constante,…",https://tinyurl.com/y6fpadkb
Engenheiro de Dados Senior,"Belo Horizonte, MG",Inklua Servicos Para Inclusao de Pcd Ltda,Atividades: Definir e manipular a arquitetura de dados da área de Business Intelligence (BI); Construir e gerenciar pipelines confiáveis de dados envolvendo…,https://tinyurl.com/y6mom35z
Engenheiro de Dados PowerCenter + BDM JR,Brasil,Red Pill RH,Banco de dados SQL Server.Nosso cliente possui a missão de auxiliar as empresas a extrair todo o potencial de Dados e Digital objetivando aumentar seu…,https://tinyurl.com/y6fz69dy
Engenheiro de Dados (Sustentação),"Campinas, SP",Kumulus Cloud e Data,"Posição focada na sustentação, análise e levantamento de requisitos, definição e modelagem de dados, extração, transformação e apresentação de dados.",https://tinyurl.com/y3cvblz4
Engenheiro de Dados Sênior,"Jaguariúna, SP",#vempraGateware,"Buscamos um Engenheiro de Dados Sênior para atuar em nosso #DreamTeamGateware alocado diretamente em nosso cliente, sendo este uma multinacional em Jaguariúna…",https://tinyurl.com/y6srolo2
Engenheiro de Dados Senior Power Center,Brasil,Red Pill RH,Solução de problemas (busca de soluções).Nosso cliente possui a missão de auxiliar as empresas a extrair todo o potencial de Dados e Digital objetivando…,https://tinyurl.com/y4pcurhh
Engenheiro de Dados Azure,Brasil,Red Pill RH,"Engenheiro de Dados Senior com no mínimo 5 anos de experiência em processos de ingestão de dados, para atuar em processo de ingestão de dados baseado em PySpark…",https://tinyurl.com/y4mryo2k
Engenheiro de Dados Informatica Cloud Sr,Brasil,Red Pill RH,Engenheiro de dados Sr. responsável pelo desenvolvimento de pipeline de dados utilizando a ferramenta Informatica Cloud com experiência em trabalhos com grandes…,https://tinyurl.com/y6jdgv2d
Engenheiro de Dados Júnior/Pleno,"São Paulo, SP",Leega Consultoria,"Extrair, organizar, tratar e disponibilizar os dados gerando indicadores para tomada de decisões gerenciais e de alto nível.",https://tinyurl.com/y5ohvl5t
Engenheiro de Dados Azure Senior,Brasil,Red Pill RH,Engenheiro de Dados Senior responsável pelo fluxo de ingestão de dados:Construir pipelines de extração de dados de diversas fontes e armazenar em um Azure Data…,https://tinyurl.com/y22sj4wd
Engenheiro de Dados Big Data Python,Brasil,Red Pill RH,"Engenheiro de dados para apoiar cliente com engenharia reversa e validação de dados em ambiente Big Data.Atuará tanto no desenvolvimento dos fluxo de carga,…",https://tinyurl.com/y2beh5g3
Engenheiro de Dados Senior (Python + GCP),Brasil,Red Pill RH,"Espera-se que este profissional tenha conhecimento em técnicas de captura, tratamento e estruturação de dados em arquitetura de processamento de dados com…",https://tinyurl.com/y5pkapc3
Engenheiro(a) de Dados Python,"São Paulo, SP",GeekHunter,"Você assume a responsabilidade por seu crescimento no trabalho diário, ao explorar novas ideias de negócios e desenvolver habilidades além das necessidades…",https://tinyurl.com/y354upwy
Engenharia de Dados - Pleno,"Belo Horizonte, MG",A3Data,"Conhecimento de modelagem de dados.Integração das plataformas de visualização de dados com Cloud.Extração de dados de diversas fontes como API, SFTP,…",https://tinyurl.com/y3a5d4yw
Engenheiro de Dados PL,"Curitiba, PR",Grupo Boticário,"Desenvolver estratégias de aquisição de dados (históricos e online), recuperação de informação, implementação de pipelines de processamentos de dados e…",https://tinyurl.com/y2ognb8g
Engenheiro de Dados Sênior ( remoto),"São Paulo, SP",HOLDEN Recruiting Talents,Experiência em banco de dados SQL SERVER;Estamos recrutando para empresa de grande porte:Experiência em Desenvolvimento e modelagem de Data Warehouse;,https://tinyurl.com/y3nxgsq4
Especialista em TI (Engenharia de Dados) - Corporativo - RJ,"Rio de Janeiro, RJ",Rede D'Or São Luiz,Resumo das principais atividades: Trabalhar com as mais novas tecnologias do mercadoAutonomia para desenvolvimento de modelos e proposta de soluções Incentivo…,https://tinyurl.com/y2jbv4bm
Engenheiro de dados SR,"São Paulo, SP",Semantix,Quer impactar bilhões de vidas com dados?Curso de inglês e espanhol (in company) - Após 03 meses de empresa.,https://tinyurl.com/yxuzgtjk
Engenheiro de Dados,"Rio de Janeiro, RJ",Morning Star Consulting,"Responsável pelo ciclo completo de uma aplicação de BI;Realizar o processo de ETL, criação de Data Marts e os integrando em um Data Warehouse e visualização…",https://tinyurl.com/y3h9uylj
Engenheiro de Dados Jr.,"São Paulo, SP",PagSeguro PagBank,Avaliar e mentorear tecnicamente os engenheiros de dados.Conhecimento em arquitetura de dados.Conhecimento em modelagem de dados.,https://tinyurl.com/y3k36msz
Estágio - Engenheiro de dados,"Curitiba, PR",ROIT,Desenvolvimento de Pipelines de ETL.Sustentação de bancos e etls.Iniciamos nosso dia com uma Daily com todos os Roiters para alinharmos expectativas e trazer…,https://tinyurl.com/y58dmcy7
@ Engenheiro de dados Informatica Cloud Sr,"São Paulo, SP",Keyrus Brazil,Engenheiro de dados Sr. responsável pelo desenvolvimento de pipeline de dados utilizando a ferramenta Informatica Cloud com experiência em trabalhos com grandes…,https://tinyurl.com/y3wd8wln
Engenheiro de Dados Azure,"Campinas, SP",Keyrus Brazil,"Engenheiro de Dados Senior com no mínimo 5 anos de experiência em processos de ingestão de dados, para atuar em processo de ingestão de dados baseado em PySpark…",https://tinyurl.com/y53jrrro
Engenheiro de Dados Jr.,"São Paulo, SP",Ernst & Young,Auxiliar na criação e manutenção de pipeline de dados.Garantir a ingestão e disponibilização de dados nos ambientes de BI.Fazer a Modelagem de Dados em ErWin;,https://tinyurl.com/y5nqaapy
Engenheiro de Dados/Big Data,"São Paulo, SP",Share RH,Realizar avaliação de conformidade dos processos de integração de dados implementados.Definir soluções que envolvam integração de dados de grande complexidade;,https://tinyurl.com/yy2cqs6p
Engenheiro/a de Dados Senior Teradata,"São Paulo, SP",Ernst & Young,Experiência em projetos de análise de dados relacionados ao Teradata / PowerCenter;Desenvolver processos de integração de dados (ETL) usando os recursos da…,https://tinyurl.com/y43l2rdu
Engenheiro de Dados - Sênior,Remoto,A3Data,Conhecimento de modelagem de dados e uso do BigQuery.Integração das plataformas de visualização de dados com Cloud.** Vaga de um cliente da Talentbrand ***.,https://tinyurl.com/yyu2qfk6
Engenheiro de Dados,"São Paulo, SP",Curriculum.com.br,"Conhecimento avançado em Modelagem de Dados; Conhecimento avançado em Integração de Dados; Conhecimento avançado em Banco de Dados (SQL, Postgre, MongoDB) e…",https://tinyurl.com/y3vupc3s
ENGENHEIRO DE DADOS,"São Paulo, SP",Ali,"Experiência em arquitetura de dados;Processamento de dados em real time;Este / Esta profissional será responsável por atribuições que incluem a construção,…",https://tinyurl.com/y4sz8rpm
Engenheiro/Cientista de Dados,"São Paulo, SP",Softtek,Conhecimento avançado de desenvolvimento com banco de dados;Domínio de linguagem de programação de back-end;Junte-se a Softtek Brasil!,https://tinyurl.com/yxdu3t8h
Engenheiro de Dados Azure Senior,"São Paulo, SP",Keyrus Brazil,Engenheiro de Dados Senior responsável pelo fluxo de ingestão de dados:Construir pipelines de extração de dados de diversas fontes e armazenar em um Azure Data…,https://tinyurl.com/y24ytzex
Engenheiro(a) de Dados Hadoop,"São Paulo, SP",GeekHunter,"Você atuara com mineração de dados bem como com mensageria e CRM do cliente da IBM, extraindo dados e tratando-os através da geração de tabelas Hive e Hbase.",https://tinyurl.com/y2w6w6ca
Engenheiro/a de Dados Senior,"São Paulo, SP",Ernst & Young,Auxilia no Desenvolvimento de novos estudos baseado em diferentes tipos de dados.Com os fornecedores de dados identificados para cada necessidade.,https://tinyurl.com/y6o7pmks
Engenheiro/a de Dados Pleno,"São Paulo, SP",Ernst & Young,Auxiliar no Desenvolvimento de novos estudos baseado em diferentes tipos de dados.Auxiliar na criação e manutenção de pipeline de dados utilizando os sistemas…,https://tinyurl.com/y34yu5n2
[Deloitte] Engenheiro de Dados,"Recife, PE",Porto Digital,"Modelagem e estruturação de dados.Nosso processo de seleção visa atrair essa pluralidade de perfis à nossa cultura corporativa, para que convivam, troquem…",https://tinyurl.com/y3c54rop
Coordenador de Engenharia de TI - Dados,"São Paulo, SP",Itaú Unibanco,"O coordenador fará a gestão de um chapter de analistas de ciências de dados que desenvolverão cases de negcios, trabalhando com métodos ágeis e grande…",https://tinyurl.com/yxg36zqv
Engenharia de Dados| Presencial,"Jaguariúna, SP",Ambev Tech,Liderar frentes técnicas de engenharia de dados;Automatizar processos de ingestão e processamento de dados.Colaborar com cientista de dados para implementar e…,https://tinyurl.com/yxj2p2um
Engenheiro de Dados,"São Paulo, SP",5A Consultoria,"Desenvolvimento de soluções com grandes volumes de dados, seja offline ou real time;Experiência com modelagem dimensional de dados reporting e dashsboards como…",https://tinyurl.com/y6mzvpq4
Diretor de Engenharia de Dados,"Campinas, SP",Michael Page,"Obrigatório experiência com liderança de times de dados focado em dados de mkt.Experiência na gestão de dados de ponta-a-ponta, com controles de qualidade,…",https://tinyurl.com/y2vtwek4
Engenheiro/a de Dados Teradata,"São Paulo, SP",Ernst & Young,Experiência em projetos de análise de dados relacionados ao Teradata / PowerCenter;Desenvolver processos de integração de dados (ETL) usando os recursos da…,https://tinyurl.com/y2x69x7c
Engenheiro/a de Dados Sênior,"Brasília, DF",Ernst & Young,Atuar em processos de desenvolvimento de componentes de integração de dados;Auxiliar no Desenvolvimento de novos estudos baseado em diferentes tipos de dados.,https://tinyurl.com/y23keqr8
Engenheiro de Dados - Pleno,Remoto,A3Data,Conhecimento de modelagem de dados e uso do BigQuery.Integração das plataformas de visualização de dados com Cloud.** Vaga de um cliente da Talentbrand ***.,https://tinyurl.com/y5ntv5ng
Engenheiro De Dados - DV,"Jaguariúna, SP",Divulga Vagas,"Construir, avaliar e executar scripts de atualização de dados de forma performática.Experiência com ferramentas de ETL e integração de dados;",https://tinyurl.com/yxeuw8lr
Engenheiro De Dados (Azure) - DV,"Campinas, SP",Divulga Vagas, Irá atuar no desenvolvimento de Pipelines de ingestão e tratamento dos dados em ambientes big data e também transacionais.,https://tinyurl.com/y65zljq5
Gerente Data and Analytics (Engenharia de Dados),"Brasília, DF",Ernst & Young,"Projetar soluções de Engenharia de Dados que usam uma coleção de tecnologias para atingir metas, dada uma ampla variedade de ambientes e tipos de dados.",https://tinyurl.com/y2bp7w8f
Engenheiro(a) de Dados,"São Paulo, SP",Ernst & Young,Garantir a ingestão e disponibilização de dados nos ambientes de BI.Coordenar o desenvolvimento de novos estudos baseado em diferentes tipos de dados.,https://tinyurl.com/y6dh3doo
Engenheiro de Dados Pleno/Sênior,"São Paulo, SP",Leega Consultoria,"Extrair, organizar, tratar e disponibilizar os dados gerando indicadores para tomada de decisões gerenciais e de alto nível.",https://tinyurl.com/yxbc3pzv
Engenheiro de Dados Sênior,"São Paulo, SP",Blend IT,Experiência com criação de pipelines de ingestão de dados usando Google Cloud.Conhecimento em criação de processos de carga de dados batch e streaming (origem…,https://tinyurl.com/y5tbv3to
Engenheiro de Dados Pleno,"São Paulo, SP",Blend IT,Experiência com criação de pipelines de ingestão de dados usando Google Cloud.Conhecimento em criação de processos de carga de dados batch e streaming (origem…,https://tinyurl.com/yxgxq6jy
Engenheiro de Dados Sênior,"São Paulo, SP",HAYS,"Pacote de benefícios atrativo de mercado!Como Engenheiro de Dados, você vai utilizar seus sólidos conhecimentos em Azure Dataflow - PowerBI Conhecimento em…",https://tinyurl.com/yyek7qma
Engenheiro de Dados (Talend),"São Paulo, SP",HAYS,"Busco um engenheiro de dados para atuar em uma Consultoria de soluções de negócios, estratégia, transformação digital, aplicações tecnológicas e outsoucing.",https://tinyurl.com/y2hkj9xy
Engenheiro de Dados,"João Pessoa, PB",Indra Company,Vivência na criação de indicadores de eficiência operacional e gestão de portfólio;Criar e monitorar painel de indicadores para gestão de negócios;,https://tinyurl.com/y542pym9
Engenheiro de Dados Sênior,"Rio de Janeiro, RJ",Zoop,"Estamos buscando engenheiros de dados que não tenham medo de sujar as mãos de graxa e colocar a mão na massa.NoNossa sede fica na Barra da Tijuca, porém, somos…",https://tinyurl.com/y32mtjbe
Engenheiro de Dados,"Morumbi, SP",Mazzatech,"EXPERIÊNCIA: Conhecimento avançado em Modelagem de Dados ; Conhecimento avançado em Integração de Dados; Conhecimento avançado em Banco de Dados (SQL, Postgre,…",https://tinyurl.com/y65nt28r
Engenheiro(a) de Dados Sênior,"São Paulo, SP",Acesso,"Conduzir projetos de soluções analíticas, identificar e viabilizar a aplicação de novas tecnologias, visando a disponibilização de dados para auxiliar na tomada…",https://tinyurl.com/yymdxn72
Engenheiro de Dados Pleno,"São Carlos, SP",Grupo diMelo,"Acompanhar release de pacotes de aplicações.Contribuir na definição das camadas de dados e seu respectivo uso;Tipo de vaga: Tempo Integral, Efetivo/CLT.",https://tinyurl.com/yyt8cadr
Engenheiro de Dados (Azure) (PI),"Campinas, SP",OEmprego,Gerenciamento de banco de dados na nuvem.Atuar na estruturação de plataforma de dados no Azure.Criação de ETL com Data Factory.| Ensino: . | Turno: Integral.,https://tinyurl.com/yxf36o4g
Engenheiro(a) de Dados Google Cloud,Brasil,GeekHunter,Construção de solução de pipeline de dados utilizando suíte Google Cloud;Será responsável pela automatização de processos e construção de pipelines.,https://tinyurl.com/y358pmqb
Engenheiro de Dados Júnior,"São Carlos, SP",Grupo diMelo,Acompanhar release de pacotes de aplicações.Participar de definições de melhores práticas para desenvolvimento de soluções existentes para um melhor…,https://tinyurl.com/y37rlq88
Engenheiro de Dados,"São Paulo, SP",OEmprego,"Sólido conhecimento em ambiente SPARK, HADOOP e soluções de ingestão de grande volume de dados.Experiência em definição de soluções de dados para necessidades…",https://tinyurl.com/y5ge7rbk
Engenheiro de Dados Pleno,"São Paulo, SP",Munhoz Fernandes Consultoria,Acompanhar release de pacotes de aplicações;Contribuir na definição das camadas de dados e seu respectivo uso;Diretrizes de distanciamento social aplicadas.,https://tinyurl.com/yymk348a
Engenheiro de Dados Sênior,"Manaus, AM","Liferay, Inc","Construir batchs em larga escala e pipelines de dados em tempo real com frameworks de processamento de dados como o Apache Beam, o Apache Spark e a Plataforma…",https://tinyurl.com/y2kfmcm7
Engenheiro(a) de Dados III,"Rio de Janeiro, RJ",PEBMED,"Conhecimentos sólidos de banco de dados, padrões e casos de uso;Construir códigos e scripts de limpeza e tratamento de dados, deduplicação, ajuste de missing…",https://tinyurl.com/y652lq53
Engenheiro de Dados Sênior,"São Paulo, SP",Grupo diMelo,Avaliar processos e direcionar adequações nas soluções visando otimização de performance de código e de infraestrutura;Principais atividades do dia a dia:,https://tinyurl.com/y2mrg22t
Analista de Engenharia de Dados Pl (SP),"São Paulo, SP",Avanade,Com a manipulação de dados e criação de processos de ETL.Experiência com técnicas de processos de ETL/Modelagem dimensional;Trabalhe com a sua paixão!,https://tinyurl.com/y6jrxk5n
Engenheiro de Dados Senior,Remoto,ilegra,"Planejar capacidade de infraestrutura de dados.Depurar incidentes de serviços de dados(crashes) e corrigir falhas, se necessário.Experiência em SQL e ETL.",https://tinyurl.com/yyj7kajo
Engenheiro(a) de Dados,"São Carlos, SP",2HRH | Hprojekt,Atuar na evolução de capacidades de ecossistema Hadoop;Avaliar processos e direcionar adequações nas soluções visando otimização de performance de código e de…,https://tinyurl.com/yytfeof2
Engenheiro de Dados Pl.,"São Paulo, SP",PagSeguro PagBank,Avaliar e mentorear tecnicamente os engenheiros de dados.Conhecimento em arquitetura de dados.Conhecimento em modelagem de dados.,https://tinyurl.com/y4ubmwxy
Engenheiro De Dados SR (Remoto) - Porto Alegre - RS,"Porto Alegre, RS",Líder e Gestão,Framework de processamento distribuído Scala;Premiação por tempo de empresa;Domínio pe Processo de ETL / ELT;Conhecimento de consultas SQL (preferencial).,https://tinyurl.com/y3buysvs
Pessoa Engenheira de Dados Sênior,"Porto Alegre, RS",Lojas Renner S.A.,Essa pessoa atuará em conjunto com os times de ciência de dados e de machine learning:No desenvolvimento e no uso de tecnologia de dados para projetos da…,https://tinyurl.com/yyzakkgf
Engenheiro(a) de Dados,"Curitiba, PR",hilab,Experiência em desenvolvimento de pipeline de dados;Manutenção e atualização do pipeline de dados;Garantir a disponibilidade de dados para o resto da empresa;,https://tinyurl.com/y6ehzcwy
Engenheiro de Dados - Sênior,"São Paulo, SP",Semantix,Quer impactar bilhões de vidas com dados?Curso de inglês e espanhol (in company) - Após 03 meses de empresa.Atuar em cliente com os itens abaixo.,https://tinyurl.com/yyfpdd6r
Engenheiro de Dados Senior Power Center,"São Paulo, SP",Keyrus Brazil,Solução de problemas (busca de soluções).Conhecimento básico de Shell script.Conhecimento de queries em SQL (Oracle);Facilidade para o trabalho em equipe;,https://tinyurl.com/y252yl4y
Engenheiro de Dados Sênior,"São Paulo, SP",TAKING,"Propor, executar, validar, apresentar e implantar o uso de tecnologias e soluções para questões técnicas e também de negócios, através de ferramentas e…",https://tinyurl.com/y47egb4c
Engenheiro de Dados SR,"Curitiba, PR",LogComex,"Desenvolver, construir, testar e manter as arquiteturas dos bancos de dados e sistemas de processamento de dados em tempo real e de forma distribuída;",https://tinyurl.com/y6ocuvn6
Engenheiro de Dados Big Data Sr,"São Paulo, SP",Workadvantage,Desenvolvimento de soluções com grandes volumes de dados;Criação de modelos de dados analíticos e indicadores;Experiência com modelagem dimensional de dados;,https://tinyurl.com/y4becr3t
Engenheiro de Dados Pleno,"Belo Horizonte, MG",Paola Salgado Gestão de Carreira,\*Gerenciamento de banco de dados na nuvem;\* Atuar na estruturação de plataforma de dados no Azure;Estamos em busca de um profissional que curta análise de…,https://tinyurl.com/y5uqr7y4
Engenheiro de Dados,"São Paulo, SP",SOS.RH CONSULTORIA,Processar e automatizar processos de criação de grandes volumes de dados.Processar e automatizar processos de criação de grandes volumes de dados.,https://tinyurl.com/yybnxag7
Engenheiro de Dados BI Sr.,"São Paulo, SP",Workadvantage, Atualizar e acompanhar indicadores de disponibilidade e processamentos de dados nas ferramentas de. Analisar e corrigir eventuais problemas na execução de…,https://tinyurl.com/y26n4emt
Engenharia de Dados | Pleno/Sênior,Brasil,Compasso UOL,Construir scripts de transformação de dados transacionais e analíticos;Montar arquiteturas e repositórios de dados na AWS;O que você vai encontrar por aqui:,https://tinyurl.com/y6evn8yh
[Zoly] Analista Engenharia de Dados,"São Paulo, SP",ZOLY,"Acompanhamento, aplicação e evolução de fluxos de processamento de dados utilizando ferramentas de automação, scripts e queries.",https://tinyurl.com/y2u9bdr8
Engenheiro de Dados,"Blumenau, SC",AMcom | Make IT real,"Bibliotecas de manipulação de arquivos e visualização de dados;Plataforma de Banco de dados Oracle;Criar pipelines confiáveis de integração de dados,…",https://tinyurl.com/y24ktqyz
Engenheiro(a) de Dados Data science sênior,"São Paulo, SP",GeekHunter,"Trabalhar próximo aos demais engenheiros de backend, cientistas de dados, analistas de dados, product owners e analistas de qualidade;O que você irá fazer?",https://tinyurl.com/yyjrqfue
Gerente - Engenheiro/a de Dados,"São Paulo, SP",EY,"Desenvolvimento de novos estudos baseado em diferentes tipos de dados.Criação e manutenção de pipeline de dados utilizando os sistemas disponíveis (Hadoop,…",https://tinyurl.com/yyg59ecb
Engenheiro de Dados Big Data Sr,"São Paulo, SP",People Talent,Desenvolvimento de soluções com grandes volumes de dados;Criação de modelos de dados analíticos e indicadores;Experiência com modelagem dimensional de dados;,https://tinyurl.com/y5yeousu
Engenheiro de Dados BI Sr.,"São Paulo, SP",People Talent, Atualizar e acompanhar indicadores de disponibilidade e processamentos de dados nas ferramentas de. Analisar e corrigir eventuais problemas na execução de…,https://tinyurl.com/y4wo5hzw
Engenheiro(a) de Dados Data science,"São Paulo, SP",GeekHunter,"Trabalhar próximo aos demais engenheiros de backend, cientistas de dados, analistas de dados, product owners e analistas de qualidade;O que você irá fazer?",https://tinyurl.com/y3ftj4ak
Analista de Engenharia de Dados Sr (SP),"São Paulo, SP",Avanade,Com a manipulação de dados e criação de processos de ETL.Experiência com técnicas de processos de ETL/Modelagem dimensional;Trabalhe com a sua paixão!,https://tinyurl.com/y2xn6nkq
Engenheiro de Dados - Pleno,"São Paulo, SP",Semantix,Quer impactar bilhões de vidas com dados?Criação de documentação de todas rotinas realizadas.Curso de inglês e espanhol (in company) - Após 03 meses de…,https://tinyurl.com/y2zwr9zq
Engenheiro de Dados,"São Paulo, SP",Semantix,Construir os processos de ingestão e integração de dados estruturados com processamento batch; Fazer a ingestão de informação não estruturada (Ex: Redes Sociais…,https://tinyurl.com/y4vssrex
Engenheiro de Dados SR,"Porto Alegre, RS",Portocred,Desenvolver métricas e atributos de qualidade de dados em nossa plataforma de BI.Conhecimento e experiência em processos de integração de dados e ferramentas…,https://tinyurl.com/y6c5onzc
Engenheiro (a) de Dados - São Paulo,"São Paulo, SP",Newik,Acompanhar release de pacotes de aplicações.Contribuir na definição das camadas de dados e seu respectivo uso;Temos vagas para nível júnior e pleno!,https://tinyurl.com/y635lrw6
Engenheiro de Dados Pleno/Sênior,Brasil,TAKING,"Conhecimentos em ferramentas de ingestão de dados AWS e Azure.Conhecimentos em modelagem de banco de dados, SQL & NoSql, Ferramentas de ETL e linguagens de…",https://tinyurl.com/yyfwfr82
Engenheiro de Dados Sênior,"São Paulo, SP",Vitta,Conhecimentos em modelagem de dados;Conhecimento em bancos de dados estruturados;Ter a oportunidade de impactar a saúde de milhões de brasileiros.,https://tinyurl.com/y39zu2nf
Analista Engenharia de Dados Sênior,"São Paulo, SP",Conquest One,"Desenvolvimento de pipeline de dados na nuvem.Entendimento de demanda de diversas áreas da empresa.Conhecimentos em banco de dados, com SQL avançado e…",https://tinyurl.com/y3559qf5
Engenheiro de Dados,"São Paulo, SP",MJV,"Além disso, vai realizar a avaliação da estruturação de dados atual e futura, proposição e desenvolvimento de uma estrutura de dados futuros e melhorias de…",https://tinyurl.com/y2zxwstn
Engenheiro (a) de Dados - São Carlos,"São Paulo, SP",Newik,Acompanhar o lançamento de pacotes de aplicações.Contribuir na definição das camadas de dados e seu respectivo uso;Temos vagas para nível júnior e pleno!,https://tinyurl.com/yx9edrqb
Engenheiro de Dados Pleno,"São Paulo, SP",Vitta,Conhecimentos em modelagem de dados;Conhecimento em bancos de dados estruturados;Ter a oportunidade de impactar a saúde de milhões de brasileiros.,https://tinyurl.com/y5ug72fp
